,Name,Allocation
0,"Taiwan Semiconductor Manufacturing Co., Ltd.",1.36%
1,Infosys Limited,1.30%
2,HCL Technologies Limited,1.19%
3,"Kweichow Moutai Co., Ltd. Class A",1.14%
4,"NetEase, Inc. Sponsored ADR",1.11%
5,Vale S.A.,1.09%
6,KB Financial Group Inc.,1.07%
7,Polyus PJSC,1.06%
8,Tata Consultancy Services Limited,1.06%
9,ITC Limited,1.06%
10,NCsoft Corporation,1.06%
11,Al Rajhi Bank,1.04%
12,Itausa - Investimentos Itau SA Pfd,1.02%
13,Hindustan Unilever Limited,1.02%
14,Longfor Group Holdings Ltd.,1.01%
15,KT & G Corporation,1.00%
16,Wal-Mart de Mexico SAB de CV,0.98%
17,Emirates Telecommunications Group Company PJSC,0.96%
18,"Shinhan Financial Group Co., Ltd.",0.94%
19,Country Garden Services Holdings Co. Ltd.,0.94%
20,Hana Financial Group Inc.,0.93%
21,China Mobile Limited,0.93%
22,NOVATEK JSC Sponsored GDR RegS,0.91%
23,"Chunghwa Telecom Co., Ltd",0.91%
24,"Advanced Info Service Public Co., Ltd. NVDR",0.90%
25,"Samsung Electronics Co., Ltd.",0.90%
26,TATNEFT PJSC,0.90%
27,AngloGold Ashanti Limited,0.89%
28,Saudi Telecom Co.,0.88%
29,Ambev SA,0.87%
30,CNOOC Limited,0.87%
31,"LARGAN Precision Co., Ltd.",0.85%
32,Oil company LUKOIL PJSC,0.85%
33,China Construction Bank Corporation Class H,0.84%
34,PT Telekomunikasi Indonesia (Persero) Tbk. Class B,0.83%
35,Gazprom PJSC,0.83%
36,Hartalega Holdings Bhd.,0.81%
37,China Petroleum & Chemical Corporation Class H,0.80%
38,China Conch Venture Holdings Ltd.,0.80%
39,Industrial and Commercial Bank of China Limited Class H,0.79%
40,Bank of China Limited Class H,0.79%
41,MMC Norilsk Nickel PJSC,0.79%
42,China Shenhua Energy Co. Ltd. Class H,0.76%
43,Anhui Conch Cement Company Limited Class H,0.74%
44,Polymetal International Plc,0.73%
45,Nestle India Ltd.,0.73%
46,Agricultural Bank of China Limited Class H,0.70%
47,Rosneft Oil Co.,0.69%
48,"Taiwan Mobile Co., Ltd.",0.68%
49,ZTO Express (Cayman) Inc. Sponsored ADR Class A,0.68%
50,Mobile TeleSystems PJSC Sponsored ADR,0.67%
51,Vodacom Group Limited,0.65%
52,Novatek Microelectronics Corp.,0.64%
53,PT Unilever Indonesia Tbk,0.63%
54,Taiwan Cement Corp.,0.62%
55,President Chain Store Corporation,0.58%
56,Asian Paints Ltd.,0.58%
57,BB Seguridade Participacoes SA,0.57%
58,"Bank of Communications Co., Ltd. Class H",0.57%
59,"Wuliangye Yibin Co., Ltd. Class A",0.56%
60,BIM Birlesik Magazalar A.S.,0.56%
61,Severstal PAO,0.54%
62,China CITIC Bank Corporation Ltd Class H,0.54%
63,Industries of Qatar Co.,0.53%
64,Telefonica Brasil SA Pfd,0.53%
65,Intouch Holdings Public Company Limited NVDR,0.51%
66,Commercial International Bank (Egypt) SAE,0.51%
67,U.S. Dollar,0.51%
68,Tech Mahindra Limited,0.50%
69,"China Minsheng Banking Corp., Ltd. Class H",0.50%
70,"Catcher Technology Co., Ltd.",0.50%
71,Surgutneftegas PJSC Pfd,0.47%
72,"China Pacific Insurance (Group) Co., Ltd. Class H",0.47%
73,"COWAY Co., Ltd.",0.46%
74,Grupo Mexico S.A.B. de C.V. Class B,0.46%
75,Eicher Motors Limited,0.43%
76,Saudi Arabian Fertilizer Co.,0.43%
77,Novolipetsk Steel,0.43%
78,DiGi.Com Bhd,0.43%
79,Clicks Group Limited,0.43%
80,Bharat Petroleum Corporation Limited,0.42%
81,Hero Motocorp Limited,0.42%
82,Enel Americas S.A.,0.41%
83,"GSX Techedu, Inc. Sponsored ADR Class A",0.41%
84,Inter RAO UES PJSC,0.41%
85,China Telecom Corp. Ltd. Class H,0.41%
86,"Foshan Haitian Flavouring & Food Co., Ltd. Class A",0.40%
87,Dabur India Limited,0.40%
88,China Resources Cement Holdings Limited,0.40%
89,Masraf Al-Rayan QSC,0.39%
90,Bajaj Auto Limited.,0.39%
91,Surgutneftegas PJSC,0.39%
92,ALROSA PJSC,0.39%
93,Yihai International Holding Ltd.,0.39%
94,Accton Technology Corp.,0.37%
95,Kumba Iron Ore Limited,0.37%
96,"Advantech Co., Ltd.",0.37%
97,Coal India Ltd.,0.37%
98,"Far Eastone Telecommunications Co., Ltd.",0.36%
99,"Woori Financial Group, Inc.",0.36%
100,PT United Tractors Tbk,0.36%
101,China National Building Material Co. Ltd. Class H,0.34%
102,Lite-On Technology Corp.,0.33%
103,Kimberly-Clark de Mexico SAB de CV Class A,0.33%
104,Grupo Aeroportuario del Pacifico SAB de CV Class B,0.33%
105,Nestle (Malaysia) Bhd.,0.33%
106,Britannia Industries Ltd,0.33%
107,Yanbu National Petrochemical Co.,0.33%
108,Vanguard International Semiconductor Co.,0.32%
109,Asustek Computer Inc.,0.32%
110,Exxaro Resources Limited,0.32%
111,Jarir Marketing Co.,0.32%
112,"Feng Tay Enterprise Co., Ltd.",0.31%
113,"GlobalWafers Co., Ltd.",0.31%
114,"China Yangtze Power Co., Ltd. Class A",0.31%
115,"Postal Savings Bank of China Co., Ltd. Class H",0.31%
116,"Guangzhou Automobile Group Co., Ltd. Class H",0.31%
117,Qatar Electricity & Water Co.,0.30%
118,Oil & Natural Gas Corp. Ltd.,0.30%
119,Ecopetrol SA,0.29%
120,Petronas Gas Bhd.,0.29%
121,Marico Limited,0.28%
122,PT Charoen Pokphand Indonesia Tbk,0.27%
123,Mr Price Group Limited,0.27%
124,Turkcell Iletisim Hizmetleri A.S.,0.27%
125,Moscow Exchange MICEX-RTS PJSC,0.27%
126,Indian Oil Corp. Ltd.,0.26%
127,Pidilite Industries Limited,0.26%
128,Nanya Technology Corporation,0.26%
129,"Korea Zinc Co., Ltd.",0.25%
130,Eregli Demir ye celik Fabrikalari T.A.S.,0.25%
131,Enel Chile SA,0.25%
132,Hindustan Petroleum Corporation Limited,0.25%
133,Polski Koncern Naftowy ORLEN S.A.,0.25%
134,"Nien Made Enterprise Co., Ltd.",0.25%
135,Qatar Fuel Q.S.C (WOQOD),0.25%
136,"Dongfeng Motor Group Co., Ltd. Class H",0.25%
137,Mesaieed Petrochemical Holding Company Q.S.C.,0.25%
138,Industrial Bank Of Korea,0.24%
139,Fibra Uno Administracion SA de CV,0.24%
140,Aldar Properties - P J S C,0.23%
141,"Eclat Textile Co., Ltd.",0.23%
142,TIM Participacoes S.A.,0.23%
143,Chicony Electronics Co. Ltd.,0.23%
144,PhosAgro PJSC Sponsored GDR RegS,0.22%
145,GAIL (India) Limited,0.22%
146,"Home Product Center Public Co., Ltd. NVDR",0.22%
147,Dubai Islamic Bank PJSC,0.22%
148,China Medical System Holdings Ltd.,0.21%
149,"Shenzhen Mindray Bio-Medical Electronics Co., Ltd. Class A",0.21%
150,Brilliance China Automotive Holdings Limited,0.20%
151,China Lesso Group Holdings Limited,0.20%
152,Petronet Lng Limited,0.20%
153,ENGIE Brasil Energia S.A.,0.20%
154,Powertech Technology Inc.,0.20%
155,"China Cinda Asset Management Co., Ltd. Class H",0.20%
156,Asia Cement Corporation,0.19%
157,Nine Dragons Paper Holdings Ltd.,0.19%
158,"Micro-Star International Co., Ltd.",0.19%
159,Walsin Technology Corporation,0.19%
160,Tiger Brands Limited,0.19%
161,Globe Telecom Inc.,0.19%
162,Magnitogorsk Iron & Steel Works PJSC,0.18%
163,"Daelim Industrial Co., Ltd",0.18%
164,Advanced Petrochemical Co.,0.18%
165,PT Gudang Garam Tbk,0.18%
166,PT Hanjaya Mandala Sampoerna Tbk,0.18%
167,"Muyuan Foods Co., Ltd. Class A",0.17%
168,Wanhua Chemical Group Co. Ltd. Class A,0.17%
169,"Dali Foods Group Co., Ltd.",0.17%
170,"Bumrungrad Hospital Public Co., Ltd. NVDR",0.17%
171,"China Taiping Insurance Holdings Co., Ltd.",0.17%
172,Page Industries Limited,0.16%
173,"China Minsheng Banking Corp., Ltd. Class A",0.16%
174,PT Indofood CBP Sukses Makmur Tbk,0.16%
175,"Henan Shuanghui Investment & Development Co., Ltd. Class A",0.16%
176,"Bank of Communications Co., Ltd. Class A",0.16%
177,HDFC Asset Management Co. Ltd.,0.16%
178,Manila Electric Co.,0.16%
179,Anhui Conch Cement Company Limited Class A,0.15%
180,S-1 Corp.,0.15%
181,Woolworths Holdings Limited,0.15%
182,Bupa Arabia for Cooperative Insurance Co.,0.15%
183,Luzhou Laojiao Company Limited Class A,0.15%
184,"BNK Financial Group, Inc.",0.15%
185,"Kumho Petrochemical Co., Ltd.",0.15%
186,Jiangsu Expressway Co. Ltd. Class H,0.15%
187,"China Everbright Bank Co., Ltd. Class H",0.14%
188,Samsung Electronics Co Ltd Pfd Non-Voting,0.14%
189,Greek Organisation of Football Prognostics SA,0.14%
190,Wharf (Holdings) Ltd.,0.14%
191,A-Living Services Co. Ltd. Class H,0.14%
192,"PLDT, Inc.",0.14%
193,Colgate-Palmolive (India) Limited,0.14%
194,Colbun S.A.,0.14%
195,Qatar International Islamic Bank,0.13%
196,PT Adaro Energy Tbk,0.13%
197,Ford Otomotiv Sanayi A.S.,0.13%
198,"Hyundai Marine & Fire Insurance Co., Ltd.",0.13%
199,Kingboard Laminates Holdings Limited,0.13%
200,Eastern Company,0.12%
201,Turkiye Is Bankasi Anonim Sirketi Class C,0.12%
202,Cielo,0.12%
203,"Sany Heavy Industry Co., Ltd. Class A",0.12%
204,Wiwynn Corp.,0.12%
205,"Gree Electric Appliances, Inc. of Zhuhai Class A",0.12%
206,Yanzhou Coal Mining Co. Ltd. Class H,0.12%
207,"China Everbright Bank Co., Ltd. Class A",0.12%
208,"Inner Mongolia Yili Industrial Group Co., Ltd. Class A",0.11%
209,Synnex Technology International Corp.,0.11%
210,Chongqing Rural Commercial Bank Co. Ltd. Class H,0.11%
211,"Yuexiu Property Co., Ltd.",0.11%
212,Agricultural Bank of China Limited Class A,0.11%
213,Saudi Airlines Catering Co.,0.11%
214,Jubilant Foodworks Limited,0.11%
215,Compania Cervecerias Unidas S.A.,0.11%
216,China Feihe Limited,0.11%
217,Saudi Cement Co.,0.10%
218,Lee & Man Paper Manufacturing Limited,0.10%
219,Bharti Infratel Ltd.,0.10%
220,Sinopec Shanghai Petrochemical Co. Ltd. Class H,0.10%
221,Aguas Andinas S.A. Class A,0.10%
222,"East Money Information Co., Ltd Class A",0.10%
223,SAIC Motor Corporation Limited Class A,0.10%
224,"China Merchants Port Holdings Co., Ltd.",0.10%
225,Megacable Hldgs SAB de CV Cert Part Ord Cons of 2 A,0.10%
226,Westports Holdings Bhd.,0.10%
227,"Jiangsu Yanghe Brewery Joint-Stock Co., Ltd. Class A",0.10%
228,"China Pacific Insurance (Group) Co., Ltd. Class A",0.10%
229,"Wuhu Sanqi Interactive Entertainment Network Technology Group Co., Ltd. Class A",0.10%
230,"Daqin Railway Co., Ltd. Class A",0.09%
231,PearlAbyss Corp.,0.09%
232,REC Limited,0.09%
233,Far East Horizon Limited,0.09%
234,MOTOR OIL (HELLAS) CORINTH REFINERIES S.A.,0.09%
235,Aselsan Elektronik Sanayi ve Ticaret A.S. Class B,0.09%
236,Standard Foods Corporation,0.09%
237,"Yuzhou Group Holdings Co., Ltd.",0.09%
238,Abdullah Al Othaim Markets Co.,0.09%
239,Porto Seguro S.A.,0.09%
240,Petronas Dagangan Bhd.,0.08%
241,"Ruentex Development Co., Ltd.",0.08%
242,"Bank of Beijing Co., Ltd. Class A",0.08%
243,Focus Media Information Technology Co Ltd Class A,0.08%
244,Hualan Biological Engineering Inc. Class A,0.08%
245,"Baoshan Iron & Steel Co., Ltd. Class A",0.08%
246,Pick N Pay Stores Limited,0.08%
247,"Wen's Foodstuff Group Co., Ltd. Class A",0.08%
248,Osotspa Public Co. Ltd. NVDR,0.08%
249,"Shenzhen Goodix Technology Co., Ltd. Class A",0.08%
250,"New Hope Liuhe Co., Ltd. Class A",0.08%
251,China Overseas Property Holdings Limited,0.08%
252,"BGF retail CO., LTD.",0.07%
253,China Shenhua Energy Co. Ltd. Class A,0.07%
254,LG Household & Health Care Ltd Pfd Registered Shs Non-Voting,0.07%
255,Oil & Gas Development Co. Ltd.,0.07%
256,"Samsung Card Co., Ltd",0.07%
257,Indraprastha Gas Limited,0.07%
258,"Weichai Power Co., Ltd. Class A",0.07%
259,Haci Omer Sabanci Holding A.S.,0.07%
260,China Hongqiao Group Ltd.,0.06%
261,"Shanghai International Airport Co., Ltd. Class A",0.06%
262,AK Medical Holdings Ltd.,0.06%
263,Carlsberg Brewery Malaysia Bhd.,0.06%
264,"Bank of Nanjing Co., Ltd. Class A",0.06%
265,"Shaanxi Coal Industry Co., Ltd. Class A",0.06%
266,"Inner Mongolia Junzheng Energy & Chemical Group Co., Ltd. Class A",0.06%
267,"Guangdong Haid Group Co., Limited Class A",0.06%
268,Shui On Land Ltd.,0.06%
269,"Shenzhen Expressway Co., Ltd. Class H",0.05%
270,China Petroleum & Chemical Corporation Class A,0.05%
271,Guangzhou Shiyuan Electronic Technology Co. Ltd. Class A,0.05%
272,HUAYU Automotive Systems Company Limited Class A,0.05%
273,Metro Pacific Investments Corporation,0.05%
274,El Sewedy Electric Company,0.05%
275,Zhejiang NHU Co. Ltd. Class A,0.05%
276,MCB Bank Limited,0.05%
277,"Seazen Holdings Co.,Ltd. Class A",0.05%
278,BAIC Motor Corporation Limited Class H,0.05%
279,"Zhejiang Supor Co., Ltd. Class A",0.05%
280,"Bank of Hangzhou Co., Ltd. Class A",0.04%
281,Sino-Ocean Group Holding Ltd.,0.04%
282,"G-Bits Network Technology (Xiamen) Co., Ltd. Class A",0.04%
283,"Yunda Holding Co., Ltd. Class A",0.04%
284,"Jafron Biomedical Co., Ltd. Class A",0.04%
285,Topchoice Medical Corp. Class A,0.04%
286,"Fuyao Glass Industry Group Co., Ltd. Class A",0.04%
287,Yealink Network Technology Co. Ltd. Class A,0.04%
288,"Hithink RoyalFlush Information Network Co., Ltd. Class A",0.04%
289,"Huaxin Cement Co., Ltd. Class A",0.04%
290,"Fujian Sunner Development Co., Ltd. Class A",0.04%
291,China Reinsurance (Group) Corp. Class H,0.04%
292,"Shanghai M&G Stationery, Inc.",0.04%
293,"Asymchem Laboratories (Tianjin) Co., Ltd. Class A",0.03%
294,"Hangzhou Robam Appliances Co., Ltd. Class A",0.03%
295,"Jiangxi Zhengbang Technology Co., Ltd. Class A",0.03%
296,Lomon Billions Group Co Ltd. Class A,0.03%
297,"Hefei Meyer Optoelectronic Technology, Inc. Class A",0.03%
298,"Autobio Diagnostics Co., Ltd. Class A",0.03%
299,"Perfect World Co., Ltd. Class A",0.03%
300,Industrial and Commercial Bank of China Limited Class A,0.03%
301,"Sichuan Chuantou Energy Co., Ltd. Class A",0.03%
302,"Shandong Hualu-Hengsheng Chemical Co., Ltd. Class A",0.03%
303,"Shenzhen Salubris Pharmaceuticals Co., Ltd. Class A",0.03%
304,"Offcn Education Technology Co., Ltd. Class A",0.03%
305,Shanghai Industrial Holdings Limited,0.03%
306,Heilongjiang Agriculture Company Limited Class A,0.03%
307,"NanJi E-Commerce Co., LTD. Class A",0.03%
308,"RiseSun Real Estate Development Co., Ltd. Class A",0.03%
309,"Shengyi Technology Co., Ltd. Class A",0.03%
310,Bank of China Limited Class A,0.03%
311,China CITIC Bank Corporation Ltd Class A,0.02%
312,"Juewei Food Co., Ltd. Class A",0.02%
313,Chongqing Brewery Co.Ltd Class A,0.02%
314,"Weihai Guangwei Composites Co., Ltd. Class A",0.02%
315,"Ovctek China, Inc. Class A",0.02%
316,"Shandong Buchang Pharmaceuticals Co., Ltd. Class A",0.02%
317,"HUBEI JUMPCAN PHARMACEUTICAL CO., LTD Class A",0.02%
318,Zhejiang Weixing New Building Materials Co. Ltd. Class A,0.02%
319,Weifu High-Technology Group Co. Ltd. Class A,0.02%
320,"Sansteel MinGuang Co., Ltd., Fujian Class A",0.02%
321,"Shandong Sunpaper Co., Ltd. Class A",0.02%
322,"Sichuan Swellfun Co., Ltd. Class A",0.02%
323,Sinopec Shanghai Petrochemical Co. Ltd. Class A,0.02%
324,"Guangzhou Wondfo Biotech Co., Ltd. Class A",0.02%
325,"Toly Bread Co., Ltd. Class A",0.02%
326,"Zhejiang Wolwo Bio-Pharmaceutical Co., Ltd. Class A",0.02%
327,"Hunan Valin Steel Co., Ltd. Class A",0.02%
328,"Shanxi Lu'An Environmental Energy Development Co., Ltd. Class A",0.02%
329,Maanshan Iron & Steel Co. Ltd. Class A,0.02%
330,"Zhejiang Juhua Co., Ltd. Class A",0.02%
331,"Jiangsu Zhongtian Technology Co., Ltd. Class A",0.02%
332,Tangshan Jidong Cement Co. Ltd. Class A,0.01%
333,Apeloa Pharmaceutical Co. Ltd. Class A,0.01%
334,"China South Publishing & Media Group Co., Ltd Class A",0.01%
335,"Beijing Kunlun Tech Co., Ltd. Class A",0.01%
336,"Chinese Universe Publishing & Media Group Co., Ltd. Class A",0.01%
337,"Anhui Kouzi Distillery Co., Ltd. Class A",0.01%
338,"Tongkun Group Co., Ltd. Class A",0.01%
339,Xiamen C&D Inc. Class A,0.01%
340,Suofeiya Home Collection Co. Ltd Class A,0.01%
341,Jiangsu Yangnong Chemical Co. Ltd. Class A,0.01%
342,Yanzhou Coal Mining Co. Ltd. Class A,0.01%
343,"Zhejiang Semir Garment Co., Ltd. Class A",0.01%
344,"Da An Gene Co., Ltd. of Sun Yat-Sen University Class A",0.01%
345,"Luenmei Quantum Co., Ltd. Class A",0.01%
346,"Beijing Capital Development Co., Ltd. Class A",0.01%
347,"Shanxi Xishan Coal & Electricity Power Co., Ltd. Class A",0.01%
348,PhosAgro PJSC Sponsored GDR RegS,0.00%
