,Name,Allocation
475,Davis Cnty Utah Sch Dist 5.0% 01-JUN-2023,0.07%
476,New York St Urban Dev Corp Rev 5.0% 15-MAR-2023,0.07%
477,Conroe Tex Indpt Sch Dist 5.0% 15-FEB-2023,0.07%
478,Garland Tex 5.0% 15-FEB-2023,0.07%
479,Illinois St 5.0% 01-JUL-2023,0.07%
480,New York N Y City Transitional Fin Auth Rev 5.0% 01-NOV-2023,0.07%
481,Dallas Fort Worth Tex Intl Arpt Rev 5.0% 01-NOV-2023,0.07%
482,California St 5.0% 01-SEP-2023,0.07%
483,Harris Cnty Tex Toll Rd Rev 5.0% 15-AUG-2023,0.07%
484,Florida St Brd Ed Lottery Rev 5.0% 01-JUL-2023,0.07%
485,Pennsylvania St 5.0% 15-JUN-2023,0.07%
486,Seattle Wash Wtr Sys Rev 5.0% 01-MAY-2023,0.07%
487,Shelby Cnty Tenn 5.0% 01-MAR-2023,0.07%
488,Washington St 5.0% 01-FEB-2023,0.07%
489,District Columbia Wtr & Swr Auth Pub Util Rev 5.0% 01-OCT-2023,0.07%
490,Chabot-Las Positas Calif Cmnty College Dist 4.0% 01-AUG-2023,0.07%
491,New York N Y City Transitional Fin Auth Rev 5.0% 01-NOV-2023,0.07%
492,California St 4.0% 01-MAY-2023,0.07%
493,Ohio St Wtr Dev Auth Wtr Pollutn Ctl Rev 5.5% 01-DEC-2023,0.07%
494,New Mexico St Severance Tax 5.0% 01-JUL-2023,0.07%
495,New Mexico St Severance Tax 5.0% 01-JUL-2023,0.07%
496,Texas A & M Univ Revs 5.0% 15-MAY-2023,0.07%
497,North Carolina St Ltd Oblig 5.0% 01-MAY-2023,0.07%
498,California St 5.0% 01-DEC-2023,0.07%
499,Houston Tex Util Sys Rev 5.0% 15-NOV-2023,0.07%
500,New Jersey St 5.0% 01-JUN-2023,0.07%
501,Charles Cnty Md 5.0% 01-OCT-2023,0.07%
502,Trinity River Auth Tex Rev 5.0% 01-FEB-2023,0.07%
503,Hawaii St Hwy Rev 5.0% 01-JAN-2023,0.07%
504,Seminole Cnty Fla Wtr & Swr Rev 5.0% 01-OCT-2023,0.07%
505,District Columbia Wtr & Swr Auth Pub Util Rev 5.0% 01-OCT-2023,0.07%
506,Texas Transn Commn St Hwy Fd Rev 5.0% 01-OCT-2023,0.07%
507,Lewisville Tex Indpt Sch Dist 5.0% 15-AUG-2023,0.07%
508,Minnesota St 5.0% 01-AUG-2023,0.07%
509,South Carolina St 5.0% 01-AUG-2023,0.07%
510,Texas St 5.0% 01-AUG-2023,0.07%
511,Louisiana St 5.0% 15-JUL-2023,0.07%
512,Georgia St 5.0% 01-JUL-2023,0.07%
513,New York N Y City Transitional Fin Auth Rev 5.0% 01-AUG-2023,0.07%
514,New York N Y City Transitional Fin Auth Rev 5.0% 01-AUG-2023,0.07%
515,Washington Subn San Dist Md 5.0% 15-JUN-2023,0.07%
516,West Va Sch Bldg Auth Excess Lottery Rev 5.0% 01-JUL-2023,0.07%
517,Arizona Brd Regents Ariz St Univ Sys Rev 5.0% 01-AUG-2023,0.07%
518,Washington D C Met Area Tran Auth Gross Rev 5.0% 01-JUL-2023,0.07%
519,New York St Dorm Auth Revs Non St Supported Debt 5.0% 01-OCT-2023,0.07%
520,Wisconsin St 5.0% 01-MAY-2023,0.07%
521,Rhode Island St & Providence Plantations 5.0% 01-MAY-2023,0.07%
522,Metropolitan St Louis Mo Swr Dist Wastewtr Sys Rev 5.0% 01-MAY-2025,0.07%
523,Nevada Sys Higher Ed Univs Rev 5.0% 01-JUL-2023,0.07%
524,Wppi Energy Wis Pwr Supply Sys Rev 5.0% 01-JUL-2023,0.07%
525,Texas St 5.0% 01-APR-2023,0.07%
526,California Edl Facs Auth Rev 5.0% 15-MAR-2023,0.07%
527,Washington St 5.25% 01-FEB-2023,0.07%
528,Connecticut St 5.0% 15-APR-2023,0.07%
529,Clark Cnty Nev Arpt Rev 5.0% 01-JUL-2023,0.07%
530,Miami-Dade Cnty Fla Sch Dist 5.0% 15-MAR-2023,0.07%
531,Virginia St Pub Sch Auth Spl Oblig Prince William Cnty 5.0% 01-MAR-2023,0.07%
532,Georgia St 5.0% 01-FEB-2023,0.07%
533,Klein Tex Indpt Sch Dist 5.0% 01-FEB-2023,0.07%
534,Los Angeles Calif Dept Wtr & Pwr Rev 4.0% 01-JUL-2023,0.07%
535,Ohio St 4.0% 01-MAY-2023,0.07%
536,Rhode Island St & Providence Plantations Lease Partn Ctfs 5.0% 01-OCT-2023,0.07%
537,California St 5.0% 01-AUG-2023,0.07%
538,Massachusetts St College Bldg Auth Rev 4.0% 01-MAY-2023,0.07%
539,Santa Fe Cnty N Mex 5.0% 01-JUL-2023,0.07%
540,Arizona St Transn Brd Excise Tax Rev 5.0% 01-JUL-2023,0.07%
541,Miami-Dade Cnty Fla Aviation Rev 5.0% 01-OCT-2023,0.07%
542,Buncombe Cnty N C Ltd Oblig 5.0% 01-JUN-2023,0.07%
543,Blount Cnty Tenn 5.0% 01-JUN-2023,0.07%
544,Austin Tex Wtr & Wastewater Sys Rev 5.0% 15-MAY-2023,0.07%
545,Long Beach Calif Cmnty College Dist 0.0% 01-MAY-2023,0.06%
546,Tarrant Regl Wtr Dist Tex Wtr Rev 5.0% 01-MAR-2023,0.06%
547,Georgia St 5.0% 01-DEC-2023,0.06%
548,Ohio St Wtr Dev Auth Wtr Pollutn Ctl Rev 5.0% 01-DEC-2023,0.06%
549,Michigan St 5.0% 01-DEC-2023,0.06%
550,Denver Colo City & Cnty Sch Dist No 1 5.0% 01-DEC-2023,0.06%
551,New Jersey St 5.0% 01-JUN-2023,0.06%
552,Snohomish Cnty Wash Sch Dist No 004 Lake Stevens 5.0% 01-DEC-2023,0.06%
553,Austin Tex Elec Util Sys Rev 5.0% 15-NOV-2023,0.06%
554,Michigan St Bldg Auth Rev 5.0% 15-OCT-2023,0.06%
555,San Jose Evergreen Calif Cmnty College Dist 5.0% 01-SEP-2023,0.06%
556,Tennessee St 5.0% 01-AUG-2023,0.06%
557,Triborough Brdg & Tunl Auth N Y Revs 5.0% 15-NOV-2023,0.06%
558,Norfolk Va 5.0% 01-AUG-2023,0.06%
559,University Tex Perm Univ Fd 5.0% 01-JUL-2023,0.06%
560,Oklahoma St Capitol Impt Auth St Facs Rev 5.0% 01-JUL-2023,0.06%
561,Virginia Comwlth Transn Brd Transn Rev 5.0% 15-MAY-2023,0.06%
562,Delaware St 5.0% 01-MAR-2023,0.06%
563,Texas St Univ Sys Fing Rev 5.0% 15-MAR-2023,0.06%
564,New York St Urban Dev Corp Rev 5.0% 15-MAR-2023,0.06%
565,Ohio St Tpk Commn Tpk Rev 5.0% 15-FEB-2023,0.06%
566,New York St Dorm Auth St Pers Income Tax Rev 5.0% 15-FEB-2023,0.06%
567,Wisconsin St 5.0% 01-NOV-2023,0.06%
568,Austin Tex 5.0% 01-SEP-2023,0.06%
569,Regional Pub Transn Auth Ariz Transn Excise Taxrev 5.25% 01-JUL-2023,0.06%
570,Hamilton Cnty Ohio Sales Tax 5.0% 01-DEC-2023,0.06%
571,University Of Ala At Birmingham Gen Rev 5.0% 01-OCT-2023,0.06%
572,Indiana Univ Revs 5.0% 01-AUG-2023,0.06%
573,Massachusetts St 5.0% 01-JUL-2023,0.06%
574,Oklahoma City Okla Wtr Utils Tr Wtr & Swr Rev 5.0% 01-JUL-2023,0.06%
575,Maine St 5.0% 01-JUN-2023,0.06%
576,Bay Area Toll Auth Calif Toll Brdg Rev 5.25% 01-APR-2053,0.06%
577,Texas A & M Univ Rev 5.0% 15-MAY-2023,0.06%
578,California St Pub Wks Brd Lease Rev 5.0% 01-MAY-2023,0.06%
579,Oregon St Dept Administrative Svcs Lottery Rev 5.0% 01-APR-2023,0.06%
580,Texas Transn Commn St Hwy Fd Rev 5.0% 01-APR-2023,0.06%
581,Spring Branch Tex Indpt Sch Dist 5.0% 01-FEB-2023,0.06%
582,Hawaii St 4.0% 01-OCT-2023,0.06%
583,Ohio St Wtr Dev Auth Rev 5.0% 01-DEC-2023,0.06%
584,Forsyth Cnty N C 5.0% 01-DEC-2023,0.06%
585,Metropolitan Transn Auth N Y Rev 5.0% 15-NOV-2023,0.06%
586,University Wash Univ Revs 4.0% 01-JUN-2023,0.06%
587,Ohio State 5.0% 15-SEP-2023,0.06%
588,District Columbia Wtr & Swr Auth Pub Util Rev 5.0% 01-OCT-2023,0.06%
589,Port Auth N Y & N J 5.0% 15-OCT-2023,0.06%
590,Columbus Ohio 5.0% 15-AUG-2023,0.06%
591,California St Pub Wks Brd Lease Rev 5.0% 01-SEP-2023,0.06%
592,Washington St 5.5% 01-JUL-2023,0.06%
593,Triborough Brdg & Tunl Auth N Y Revs 5.0% 15-NOV-2023,0.06%
594,Salem-Keizer Ore Sch Dist No 24J 0.0% 15-JUN-2023,0.06%
595,Oklahoma Agric & Mechanical Colleges Rev 5.0% 01-AUG-2023,0.06%
596,Wisconsin St Transn Rev 5.0% 01-JUL-2023,0.06%
597,Escondido Calif Un High Sch Dist 0.0% 01-AUG-2023,0.06%
598,Knox Cnty Tenn 5.0% 01-JUN-2023,0.06%
599,Virginia Comwlth Transn Brd Transn Rev 5.0% 15-MAY-2023,0.06%
600,University N Mex Univ Revs 5.0% 01-JUN-2023,0.06%
601,Delaware St 5.0% 01-FEB-2023,0.06%
602,Forsyth Cnty Ga Sch Dist 5.0% 01-FEB-2023,0.06%
603,Orange Cnty Fla Sales Tax Rev 5.0% 01-JAN-2023,0.06%
604,King Cnty Wash Sch Dist No 403 Renton 5.0% 01-DEC-2023,0.06%
605,Indiana Mun Pwr Agy Pwr Supply Sys Rev 5.0% 01-JAN-2023,0.06%
606,Las Vegas Valley Nev Wtr Dist 5.0% 01-DEC-2023,0.06%
607,California St Pub Wks Brd Lease Rev 5.0% 01-DEC-2023,0.06%
608,Oregon St Dept Transn Hwy User Tax Rev 5.0% 15-NOV-2023,0.06%
609,Connecticut St 5.0% 15-NOV-2023,0.06%
610,Maine Mun Bd Bk 5.0% 01-NOV-2023,0.06%
611,Long Is Pwr Auth N Y Elec Sys Rev 5.0% 01-SEP-2023,0.06%
612,Washington St 5.0% 01-AUG-2023,0.06%
613,New Hampshire Mun Bd Bk 5.0% 15-AUG-2023,0.06%
614,Delaware St 5.0% 01-JUL-2023,0.06%
615,Metropolitan Wtr Dist Southn Calif Wtrwrks Rev 5.0% 01-JUL-2023,0.06%
616,Palm Beach Cnty Fla Sch Brd Ctfs Partn 5.0% 01-AUG-2023,0.06%
617,New York N Y 5.0% 01-AUG-2023,0.06%
618,Connecticut St Revolving Fd Gen Rev 5.0% 01-JUN-2023,0.06%
619,University Ala Gen Rev 5.0% 01-JUL-2023,0.06%
620,Wichita Kans 5.0% 01-JUN-2023,0.06%
621,New York St Environmental Facs Corp Rev 5.0% 15-MAY-2023,0.06%
622,Grand River Dam Auth Okla Rev 5.0% 01-JUN-2023,0.06%
623,Louisville & Jefferson Cnty Ky Met Swr Dist Swr& Drain Sys Rev 5.0% 15-MAY-2023,0.06%
624,Missouri St Hwys & Trans Commn St Rd Rev 5.0% 01-MAY-2023,0.06%
625,New Hampshire Health & Ed Facs Auth Rev 5.0% 01-JUL-2023,0.06%
626,Nevada St 5.0% 01-APR-2023,0.06%
627,Port Tacoma Wash Rev 4.0% 01-DEC-2023,0.06%
628,Conroe Tex Indpt Sch Dist 5.0% 15-FEB-2023,0.06%
629,Texas Transn Commn Cent Tex Tpk Sys Rev 5.0% 15-AUG-2023,0.06%
630,Leesburg Va 5.0% 15-JAN-2023,0.06%
631,North East Indpt Sch Dist Tex 5.0% 01-FEB-2023,0.06%
632,Snohomish Cnty Wash Sch Dist No 201 5.0% 01-DEC-2023,0.06%
633,Houston Tex Util Sys Rev 5.0% 15-NOV-2023,0.06%
634,Wisconsin St 5.0% 01-NOV-2023,0.06%
635,New York N Y City Transitional Fin Auth Rev 4.0% 01-AUG-2023,0.06%
636,Honolulu Hawaii City & Cnty 5.0% 01-OCT-2023,0.05%
637,Prince Georges Cnty Md 5.0% 15-SEP-2023,0.05%
638,California St Pub Wks Brd Lease Rev 5.0% 01-SEP-2023,0.05%
639,Northside Tex Indpt Sch Dist 5.0% 15-AUG-2023,0.05%
640,Washington St Univ Revs 5.0% 01-OCT-2023,0.05%
641,Klein Tex Indpt Sch Dist 5.0% 01-AUG-2023,0.05%
642,Phoenix Ariz 5.0% 01-JUL-2023,0.05%
643,Miami-Dade Cnty Fla 5.0% 01-JUL-2023,0.05%
644,Indiana Fin Auth Hwy Rev 5.0% 01-JUN-2023,0.05%
645,Connecticut St 5.0% 15-JUN-2023,0.05%
646,Missouri St Hwys & Trans Commn St Rd Rev 5.0% 01-MAY-2023,0.05%
647,Oregon St Dept Administrative Svcs Lottery Rev 5.0% 01-APR-2023,0.05%
648,Southeastern Pa Transn Auth Rev 5.0% 01-JUN-2023,0.05%
649,Northwest Tex Indpt Sch Dist 5.0% 15-FEB-2023,0.05%
650,Monmouth Cnty N J 5.0% 15-JAN-2023,0.05%
651,California St Dept Wtr Res Cent Vy Proj Rev 5.0% 01-DEC-2023,0.05%
652,Virginia Commlth Transn Brd Fed Transn Grnt Antic Rev 5.0% 15-SEP-2023,0.05%
653,Ohio St 5.0% 01-SEP-2023,0.05%
654,Harris Cnty Tex 5.0% 15-AUG-2023,0.05%
655,Los Angeles Calif Uni Sch Dist 5.0% 01-JUL-2023,0.05%
656,Ohio St Wtr Dev Auth Wtr Pollutn Ctl Rev 5.0% 01-JUN-2023,0.05%
657,Wisconsin St Health & Edl Facs Auth Rev 5.0% 15-AUG-2023,0.05%
658,Huntsville Ala 5.0% 01-MAY-2023,0.05%
659,Anne Arundel Cnty Md 5.0% 01-APR-2023,0.05%
660,Illinois St 5.0% 01-FEB-2023,0.05%
661,King Cnty Wash 5.25% 01-JAN-2023,0.05%
662,Gwinnett Cnty Ga Dev Auth Ctfs Partn 5.25% 01-JAN-2023,0.05%
663,Las Vegas Nev 5.0% 01-JUN-2023,0.05%
664,Wisconsin St Clean Wtr Rev 5.0% 01-JUN-2023,0.05%
665,Southern Minn Mun Pwr Agy Pwr Supply Sys Rev 5.0% 01-JAN-2023,0.05%
666,Oregon St Dept Transn Hwy User Tax Rev 5.0% 15-NOV-2023,0.05%
667,Maine Mun Bd Bk 5.0% 01-NOV-2023,0.05%
668,Chicago Ill O Hare Intl Arpt Rev 5.0% 01-JAN-2023,0.05%
669,Orange Cnty Fla Wtr & Wastewtr Rev 5.0% 01-OCT-2023,0.05%
670,Texas St 5.0% 01-OCT-2023,0.05%
671,Massachusetts St 5.0% 01-OCT-2023,0.05%
672,Central Utah Wtr Conservancy Dist Wtr Rev 5.0% 01-OCT-2023,0.05%
673,Washington St 5.0% 01-AUG-2023,0.05%
674,California Health Facs Fing Auth Rev 5.0% 15-NOV-2023,0.05%
675,Pennsylvania St Tpk Commn Registration Fee Rev 5.25% 15-JUL-2023,0.05%
676,Energy Northwest Wash Elec Rev 5.0% 01-JUL-2023,0.05%
677,New York N Y 5.0% 01-AUG-2023,0.05%
678,North Carolina St 5.0% 01-JUN-2023,0.05%
679,Washington Subn San Dist Md 5.0% 01-JUN-2023,0.05%
680,Northside Tex Indpt Sch Dist 3.0% 15-AUG-2023,0.05%
681,University Calif Revs 5.0% 15-MAY-2023,0.05%
682,Pennsylvania Intergovernmental Coop Auth Spl Taxrev 5.0% 15-JUN-2023,0.05%
683,San Antonio Tex Wtr Rev 5.0% 15-MAY-2023,0.05%
684,Ohio St 5.0% 01-MAY-2023,0.05%
685,Illinois St 5.0% 01-JUN-2023,0.05%
686,Delaware Cnty Pa Auth Univ Rev 5.0% 01-AUG-2023,0.05%
687,Washington Cnty Utah Sch Dist St George 5.0% 01-MAR-2023,0.05%
688,San Antonio Tex Elec & Gas Rev 5.0% 01-FEB-2023,0.05%
689,Pennsylvania St 5.0% 01-FEB-2023,0.05%
690,Hennepin Cnty Minn 5.0% 01-DEC-2023,0.05%
691,King Cnty Wash Sch Dist No 405 Bellevue 5.0% 01-DEC-2023,0.05%
692,North Carolina Mun Pwr Agy No 1 Catawba Elec Rev 5.0% 01-JAN-2023,0.05%
693,North Dakota Pub Fin Auth 5.0% 01-OCT-2023,0.05%
694,Rhode Is Infrastructure Bk Wtr Pollution Ctl Rev 5.0% 01-OCT-2023,0.05%
695,New York N Y City Transitional Fin Auth Rev 5.0% 01-NOV-2023,0.05%
696,Harris Cnty Tex Met Tran Auth Sales & Use Tax 5.0% 01-NOV-2023,0.05%
697,Fort Bend Tex Indpt Sch Dist 5.0% 15-AUG-2023,0.05%
698,Henrico Cnty Va 5.0% 01-AUG-2023,0.05%
699,Alabama St 5.0% 01-AUG-2023,0.05%
700,Wisconsin St Transn Rev 5.0% 01-JUL-2023,0.05%
701,Los Angeles Calif Dept Wtr & Pwr Rev 5.0% 01-JUL-2023,0.05%
702,Florida St Dept Environmental Protn Preservationrev 5.0% 01-JUL-2023,0.05%
703,Connecticut St Spl Tax Oblig Rev 5.0% 01-AUG-2023,0.05%
704,Santa Clara Cnty Calif Fing Auth Lease Rev 5.0% 15-MAY-2023,0.05%
705,Massachusetts St 5.0% 01-MAY-2023,0.05%
706,E 470 Pub Hwy Auth Colo Rev 0.0% 01-SEP-2023,0.05%
707,Clark Cnty Wash Sch Dist No 117 Camas 5.0% 01-DEC-2023,0.05%
708,Seattle Wash 5.0% 01-DEC-2023,0.05%
709,Port Tacoma Wash 5.0% 01-DEC-2023,0.05%
710,University Wash Univ Revs 5.0% 01-DEC-2023,0.05%
711,West Virginia St 5.0% 01-DEC-2023,0.05%
712,San Francisco Calif City & Cnty Pub Utils Commnwtr Rev 5.0% 01-NOV-2023,0.05%
713,Ohio St 5.0% 01-NOV-2023,0.05%
714,Seattle Wash 5.0% 01-NOV-2023,0.05%
715,Memphis Tenn 5.0% 01-NOV-2023,0.05%
716,Connecticut St 5.0% 15-NOV-2023,0.05%
717,Port Auth N Y & N J 5.0% 01-DEC-2023,0.05%
718,Ohio Univ Gen Rcpts Athens 5.0% 01-DEC-2023,0.05%
719,New Hampshire Mun Bd Bk 5.25% 15-AUG-2023,0.05%
720,Minnesota St 5.0% 01-OCT-2023,0.05%
721,Missouri St Brd Pub Bldgs Spl Oblig 5.0% 01-OCT-2023,0.05%
722,Honolulu Hawaii City & Cnty 5.0% 01-OCT-2023,0.05%
723,Ohio State 5.0% 15-SEP-2023,0.05%
724,Prince William Cnty Va Ctfs Partn 5.0% 01-OCT-2023,0.05%
725,Denver Colo City & Cnty Brd Wtr Commrs Master Resolution Wtr Rev 5.0% 15-SEP-2023,0.05%
726,Austin Tex 5.0% 01-SEP-2023,0.05%
727,California St 5.0% 01-SEP-2023,0.05%
728,California St 5.0% 01-SEP-2023,0.05%
729,Plano Tex 5.0% 01-SEP-2023,0.05%
730,Vermont St 5.0% 15-AUG-2023,0.05%
731,Wake Cnty N C Ltd Oblig 5.0% 01-SEP-2023,0.05%
732,Connecticut St 5.0% 15-SEP-2023,0.05%
733,University Tex Univ Revs 5.0% 15-AUG-2023,0.05%
734,New Hampshire Mun Bd Bk 5.0% 15-AUG-2023,0.05%
735,Denton Tex Indpt Sch Dist 5.0% 15-AUG-2023,0.05%
736,Washington St 5.0% 01-AUG-2023,0.05%
737,Maryland St 5.0% 01-AUG-2023,0.05%
738,Virginia St Pub Sch Auth Sch Fing 5.0% 01-AUG-2023,0.05%
739,Prince William Cnty Va 5.0% 01-AUG-2023,0.05%
740,California St 5.0% 01-AUG-2023,0.05%
741,Wyandotte Cnty/Kans City Kans Uni Govt 5.0% 01-AUG-2023,0.05%
742,Manor Tex Indpt Sch Dist 5.0% 01-AUG-2023,0.05%
743,Los Angeles Cnty Calif Met Transn Auth Sales Taxrev 5.0% 01-JUL-2023,0.05%
744,Ohio St Higher Edl Fac Rev 5.0% 01-DEC-2023,0.05%
745,Columbus Ohio 5.0% 01-JUL-2023,0.05%
746,Scottsdale Ariz 5.0% 01-JUL-2023,0.05%
747,Tucson Ariz Wtr Rev 5.0% 01-JUL-2023,0.05%
748,Massachusetts St 5.0% 01-JUL-2023,0.05%
749,Phoenix Ariz Civic Impt Corp Excise Tax Rev 5.0% 01-JUL-2023,0.05%
750,Connecticut St Spl Tax Oblig Rev 5.0% 01-SEP-2023,0.05%
751,Wisconsin St Transn Rev 5.0% 01-JUL-2023,0.05%
752,Los Angeles Calif Dept Wtr & Pwr Rev 5.0% 01-JUL-2023,0.05%
753,Los Angeles Calif Dept Wtr & Pwr Rev 5.0% 01-JUL-2023,0.05%
754,Austin Tex Cmnty College Dist Pub Fac Corp Leaserev 5.0% 01-AUG-2023,0.05%
755,Energy Northwest Wash Elec Rev 5.0% 01-JUL-2023,0.05%
756,Arizona St Transn Brd Excise Tax Rev 5.0% 01-JUL-2023,0.05%
757,Massachusetts Bay Transn Auth Mass Sales Tax Rev 5.0% 01-JUL-2023,0.05%
758,Jacksonville Fla Spl Rev 5.0% 01-OCT-2023,0.05%
759,Florida St 5.0% 01-JUL-2023,0.05%
760,New York N Y City Transitional Fin Auth Bldg Aidrev 5.0% 15-JUL-2023,0.05%
761,San Mateo Cnty Calif Jt Pwrs Fing Auth Lease Rev 5.0% 15-JUL-2023,0.05%
762,Southwest Higher Ed Auth Inc Tex Rev 5.0% 01-OCT-2023,0.05%
763,Metropolitan Govt Nashville & Davidson Cnty Tennwtr & Swr 5.0% 01-JUL-2023,0.05%
764,Salem Ore 5.0% 01-JUN-2023,0.05%
765,Virginia St 5.0% 01-JUN-2023,0.05%
766,Washington St 5.0% 01-JUN-2023,0.05%
767,Oregon St 5.0% 01-JUN-2023,0.05%
768,West Va Wtr Dev Auth Infrastructure Excess Lottery Rev 5.0% 01-JUL-2023,0.05%
769,East Bay Calif Mun Util Dist Wtr Sys Rev 5.0% 01-JUN-2023,0.05%
770,Maine St 5.0% 01-JUN-2023,0.05%
771,Stamford Conn 5.0% 01-JUN-2023,0.05%
772,Texas St 5.0% 15-MAY-2023,0.05%
773,Alabama St Pub Sch & College Auth 5.0% 01-JUN-2023,0.04%
774,Oregon St 5.0% 01-MAY-2023,0.04%
775,Wisconsin St 5.0% 01-MAY-2023,0.04%
776,Hillsborough Cnty Fla Sch Brd Ctfs Partn 5.0% 01-JUL-2023,0.04%
777,Utah St Bldg Ownership Auth Lease Rev 5.0% 15-MAY-2023,0.04%
778,New Jersey St Transn Tr Fd Auth 5.75% 15-JUN-2023,0.04%
779,Nevada Sys Higher Ed Univs Rev 5.0% 01-JUL-2023,0.04%
780,Tarrant Cnty Tex Cultural Ed Facs Fin Corp Hosprev 5.0% 15-AUG-2023,0.04%
781,Texas Water Dev Brd 5.0% 15-APR-2023,0.04%
782,New Castle Cnty Del 5.0% 01-APR-2023,0.04%
783,Bay Area Toll Auth Calif Toll Brdg Rev 5.0% 01-APR-2043,0.04%
784,North Tex Mun Wtr Dist Tex Regl Wastewtr Sys Contract Rev 5.0% 01-JUN-2023,0.04%
785,University N Mex Univ Revs 5.0% 01-JUN-2023,0.04%
786,Lower Colo Riv Auth Tex Transmission Contract Rev 5.0% 15-MAY-2023,0.04%
787,University North Tex Univ Rev 5.0% 15-APR-2023,0.04%
788,New Hampshire St 5.0% 01-MAR-2023,0.04%
789,Houston Tex 5.0% 01-MAR-2023,0.04%
790,Clear Creek Tex Indpt Sch Dist 5.0% 15-FEB-2023,0.04%
791,University Conn 5.0% 15-APR-2023,0.04%
792,Cypress-Fairbanks Tex Indpt Sch Dist 5.0% 15-FEB-2023,0.04%
793,Massachusetts St 4.2% 01-AUG-2023,0.04%
794,Salt Lake City Utah Pub Utils Rev 5.0% 01-FEB-2023,0.04%
795,California St 4.0% 01-OCT-2023,0.04%
796,California St 5.0% 01-FEB-2023,0.04%
797,Honolulu Hawaii City & Cnty 4.0% 01-OCT-2023,0.04%
798,Triborough Brdg & Tunl Auth N Y Revs 5.0% 15-NOV-2023,0.04%
799,University Conn 5.0% 15-FEB-2023,0.04%
800,Oklahoma St Capitol Impt Auth St Facs Rev 5.0% 01-JAN-2023,0.04%
801,New York N Y City Transitional Fin Auth Rev 4.0% 01-AUG-2023,0.04%
802,New Jersey Economic Dev Auth Rev 5.0% 15-JUN-2023,0.04%
803,New York St Twy Auth Gen Rev 5.0% 01-JAN-2023,0.04%
804,Chicago Ill O Hare Intl Arpt Rev 5.0% 01-JAN-2023,0.04%
805,Hennepin Cnty Minn 5.0% 01-DEC-2023,0.04%
806,Central Tex Regl Mobility Auth Rev 5.0% 01-JAN-2023,0.04%
807,Illinois St Sales Tax Rev 5.0% 15-JUN-2023,0.04%
808,Ohio St 5.0% 01-NOV-2023,0.04%
809,Missouri St Hwys & Trans Commn St Rd Rev 4.0% 01-MAY-2023,0.04%
810,San Mateo Cnty Calif Cmnty College Dist 0.0% 01-SEP-2023,0.04%
811,Washington St 5.0% 01-JUL-2023,0.04%
812,San Diego Calif Uni Sch Dist 3.0% 01-JUL-2023,0.04%
813,Washington St Ctfs Partn 5.0% 01-JUL-2023,0.04%
814,University Wash Univ Revs 4.0% 01-DEC-2023,0.04%
815,Pasadena Tex Indpt Sch Dist 5.0% 15-FEB-2023,0.04%
816,Katy Tex Indpt Sch Dist 5.0% 15-FEB-2023,0.04%
817,Virginia College Bldg Auth Va Edl Facs Rev 21Stcenty Colleg E & Equip Prog 5.0% 01-FEB-2023,0.04%
818,Montgomery Cnty Md 5.0% 01-NOV-2023,0.04%
819,King Cnty Wash Sch Dist No 415 Kent 5.0% 01-DEC-2023,0.04%
820,Las Virgenes Calif Uni Sch Dist 0.0% 01-SEP-2023,0.04%
821,Portland Ore Swr Sys Rev 5.0% 01-OCT-2023,0.04%
822,Harris Cnty Tex 5.0% 01-OCT-2023,0.04%
823,Arkansas Dev Fin Auth St Agy Facs Rev 5.0% 01-NOV-2023,0.04%
824,Miami-Dade Cnty Fla Wtr & Swr Rev 5.0% 01-OCT-2023,0.04%
825,San Diego Calif Uni Sch Dist 0.0% 01-JUL-2023,0.04%
826,Maryland St 5.0% 01-AUG-2023,0.04%
827,Magnolia Tex Indpt Sch Dist 5.0% 15-AUG-2023,0.04%
828,Washington St 5.0% 01-JUL-2023,0.04%
829,Phoenix Ariz Civic Impt Corp Wastewater Sys Rev 5.0% 01-JUL-2023,0.04%
830,Orange Cnty Fla Sch Brd Ctfs Partn 5.0% 01-AUG-2023,0.04%
831,Iowa St Spl Oblig 5.0% 15-JUN-2023,0.04%
832,New Mexico Fin Auth Rev 5.0% 01-JUN-2023,0.04%
833,Virginia Comwlth Transn Brd Transn Rev 5.0% 15-MAY-2023,0.04%
834,Grapevine-Colleyville Indpt Sch Dist Tex 0.0% 15-AUG-2023,0.04%
835,Santa Monica-Malibu Uni Sch Dist Calif 0.0% 01-AUG-2023,0.04%
836,Texas St 5.0% 01-OCT-2023,0.04%
837,California St Pub Wks Brd Lease Rev 5.0% 01-OCT-2023,0.04%
838,Leander Tex Indpt Sch Dist 5.0% 15-AUG-2023,0.04%
839,Ohio State 5.0% 01-AUG-2023,0.04%
840,Los Angeles Calif Dept Wtr & Pwr Rev 5.0% 01-JUL-2023,0.04%
841,Jacksonville Fla Cap Impt Rev 5.0% 01-OCT-2023,0.04%
842,Lower Colo Riv Auth Tex Rev 5.0% 15-MAY-2023,0.04%
843,Georgia St Rd & Twy Auth Rev 5.0% 01-JUN-2023,0.04%
844,Minnesota Pub Facs Auth St Revolving Fd Rev 5.0% 01-MAR-2023,0.04%
845,Idaho Hsg & Fin Assn 5.0% 15-JUL-2023,0.04%
846,Elk River Minn Indpt Sch Dist No 728 5.0% 01-FEB-2023,0.04%
847,New Jersey St 5.0% 01-JUN-2023,0.04%
848,Purdue Univ Ind Univ Revs 4.0% 01-JUL-2023,0.04%
849,Oregon St Dept Transn Hwy User Tax Rev 5.0% 15-NOV-2023,0.04%
850,Atlanta Ga Wtr & Wastewtr Rev 5.0% 01-NOV-2023,0.04%
851,Miami-Dade Cnty Fla Expwy Auth Toll Sys Rev 4.0% 01-JUL-2023,0.04%
852,Pennsylvania St Tpk Commn Oil Franchise Tax Rev 5.0% 01-DEC-2023,0.04%
853,Hawaii St 5.0% 01-OCT-2023,0.04%
854,Plano Tex 5.0% 01-SEP-2023,0.04%
855,Frisco Tex Indpt Sch Dist 5.0% 15-AUG-2023,0.04%
856,Virginia St Pub Sch Auth Sch Fing 5.0% 01-AUG-2023,0.04%
857,Florida St Tpk Auth Tpk Rev 5.0% 01-JUL-2023,0.04%
858,Metropolitan Govt Nashville & Davidson Cnty Tenn 5.0% 01-JUL-2023,0.04%
859,New York N Y City Transitional Fin Auth Bldg Aidrev 5.0% 15-JUL-2023,0.04%
860,Wppi Energy Wis Pwr Supply Sys Rev 5.0% 01-JUL-2023,0.04%
861,Ohio St 5.0% 01-APR-2023,0.04%
862,Missouri St Environmental Impt & Energy Res Authwtr Pollutn Ctl & Drinking Wtrrev 5.0% 01-JAN-2023,0.04%
863,North Tex Mun Wtr Dist Upper E Fork Wstwtr Intrcpt Contract Rev 6.25% 01-JUN-2023,0.03%
864,Loudoun Cnty Va 5.0% 01-DEC-2023,0.03%
865,Massachusetts Bay Transn Auth Mass Sales Tax Rev 5.5% 01-JUL-2023,0.03%
866,Texas St 5.0% 01-OCT-2023,0.03%
867,Massachusetts St Wtr Res Auth 5.25% 01-AUG-2023,0.03%
868,Jordan Vy Wtr Conservancy Dist Utah 5.0% 01-OCT-2023,0.03%
869,Portland Ore Swr Sys Rev 5.0% 01-OCT-2023,0.03%
870,Tampa Fla Sales Tax Rev 5.0% 01-OCT-2023,0.03%
871,Hawaii Cnty Hawaii 5.0% 01-SEP-2023,0.03%
872,Minnesota St 5.0% 01-AUG-2023,0.03%
873,Alaska St 5.0% 01-AUG-2023,0.03%
874,Georgia St 5.0% 01-JUL-2023,0.03%
875,Massachusetts Bay Transn Auth Mass Sales Tax Rev 5.0% 01-JUL-2023,0.03%
876,New York N Y 5.0% 01-AUG-2023,0.03%
877,Delaware Cnty Pa Auth Univ Rev 5.0% 01-DEC-2023,0.03%
878,Florida St Brd Ed Pub Ed 5.0% 01-JUN-2023,0.03%
879,Virginia Comwlth Transn Brd Transn Rev 5.0% 15-MAY-2023,0.03%
880,Salem Ore Wtr & Swr Rev 5.0% 01-JUN-2023,0.03%
881,Clark Cnty Nev 5.0% 01-JUN-2023,0.03%
882,Reedy Creek Impt Dist Fla 5.0% 01-JUN-2023,0.03%
883,Texas Water Dev Brd 5.0% 15-APR-2023,0.03%
884,Fairfax Cnty Va 5.0% 01-APR-2023,0.03%
885,Oklahoma St Wtr Res Brd Revolving Fd Rev 5.0% 01-APR-2023,0.03%
886,Virginia St Res Auth Infrastructure Rev 4.0% 01-NOV-2023,0.03%
887,Ohio St Mental Health Cap Facs 5.0% 01-FEB-2023,0.03%
888,Virginia St Pub Bldg Auth Pub Facs Rev 4.0% 01-AUG-2023,0.03%
889,Massachusetts St Tpk Auth Met Hwy Sys Rev 0.0% 01-JAN-2023,0.03%
890,Washington St 4.0% 01-JUL-2023,0.03%
891,Los Angeles Calif Wastewtr Sys Rev 4.0% 01-JUN-2023,0.03%
892,New Jersey St Edl Facs Auth Rev 5.0% 15-JUN-2023,0.03%
893,Washington Cnty Tenn 4.0% 01-JUN-2023,0.03%
894,Louisiana St 4.0% 01-SEP-2023,0.03%
895,New Jersey St Edl Facs Auth Rev 5.0% 01-JUN-2023,0.03%
896,Hawaii St 4.0% 01-MAY-2023,0.03%
897,California Health Facs Fing Auth Rev 4.0% 01-MAR-2023,0.03%
898,Hennepin Cnty Minn 5.0% 01-DEC-2023,0.03%
899,Chesterfield Cnty Va Wtr & Swr Rev 5.0% 01-NOV-2023,0.03%
900,Massachusetts St 5.25% 01-AUG-2023,0.03%
901,Hawaii St 5.0% 01-OCT-2023,0.03%
902,Arizona Wtr Infrastructure Fin Auth Rev 5.0% 01-OCT-2023,0.03%
903,Oregon St 5.0% 01-AUG-2023,0.03%
904,Wayne Cnty Mich Arpt Auth Rev 5.0% 01-DEC-2023,0.03%
905,Metropolitan Govt Nashville & Davidson Cnty Tennwtr & Swr 5.0% 01-JUL-2023,0.03%
906,Orlando & Orange Cnty Expwy Auth Fla Expwy Rev 5.0% 01-JUL-2023,0.03%
907,Indiana Univ Revs 5.0% 01-JUN-2023,0.03%
908,Maine St Tpk Auth Tpk Rev 5.0% 01-JUL-2023,0.03%
909,Reedy Creek Impt Dist Fla 5.0% 01-JUN-2023,0.03%
910,Williamson Cnty Tenn 5.0% 01-APR-2023,0.03%
911,Benicia Calif Uni Sch Dist 0.0% 01-AUG-2023,0.03%
912,Phoenix Ariz Civic Impt Corp Arpt Rev 5.0% 01-JUL-2023,0.03%
913,Fort Worth Tex Wtr & Swr Rev 5.0% 15-FEB-2023,0.03%
914,Wisconsin St Transn Rev 4.0% 01-JUL-2023,0.03%
915,Port Seattle Wash Rev 5.0% 01-MAR-2023,0.03%
916,California St Dept Wtr Res Cent Vy Proj Rev 5.0% 01-DEC-2023,0.03%
917,Spokane & Whitman Cntys Wash Cheney Sch Dist No360-316 5.0% 01-DEC-2023,0.03%
918,Phoenix Ariz Civic Impt Corp Wtr Sys Rev 5.5% 01-JUL-2023,0.03%
919,California St Pub Wks Brd Lease Rev 5.0% 01-NOV-2023,0.03%
920,Tennessee St Sch Bd Auth 5.0% 01-NOV-2023,0.03%
921,Austin Tex 5.0% 01-SEP-2023,0.03%
922,Minnesota St 5.0% 01-AUG-2023,0.03%
923,New York St Dorm Auth Revs Non St Supported Debt 5.0% 01-OCT-2023,0.03%
924,North Carolina St 5.0% 01-JUN-2023,0.03%
925,Pierce Cnty Wash Sch Dist No 403 Bethel 5.0% 01-JUN-2023,0.03%
926,Florida St Mun Pwr Agy Rev 5.0% 01-OCT-2023,0.03%
927,University Calif Revs 5.0% 15-MAY-2023,0.03%
928,Clark Cnty Nev Hwy Impt Rev 5.0% 01-JUL-2023,0.03%
929,Miami-Dade Cnty Fla Sch Dist 5.0% 15-MAR-2023,0.03%
930,Phoenix Ariz Civic Impt Corp Arpt Rev 5.0% 01-JUL-2023,0.03%
931,Plano Tex Indpt Sch Dist 5.0% 15-FEB-2023,0.03%
932,Connecticut St Spl Tax Oblig Rev 5.0% 01-JAN-2023,0.03%
933,California St Univ Rev 5.0% 01-NOV-2023,0.03%
934,Charleston Edl Excellence Fing Corp S C Rev 5.0% 01-DEC-2023,0.03%
935,Gainesville Ga Wtr & Sew Rev 5.0% 15-NOV-2023,0.03%
936,Newport News Va 5.0% 01-AUG-2023,0.03%
937,Round Rock Tex Indpt Sch Dist 5.0% 01-AUG-2023,0.03%
938,Ohio St Higher Edl Fac Commn Rev 5.0% 01-DEC-2023,0.03%
939,Washington St Ctfs Partn 5.0% 01-JUL-2023,0.03%
940,East Bay Calif Mun Util Dist Wtr Sys Rev 5.0% 01-JUN-2023,0.03%
941,Metropolitan Govt Nashville & Davidson Cnty Tennelec Rev 5.0% 15-MAY-2023,0.03%
942,Hillsborough Cnty Fla Sch Brd Ctfs Partn 5.0% 01-JUL-2023,0.03%
