,Name,Allocation
943,New York St Dorm Auth Revs Non St Supported Debt 5.0% 01-JUL-2023,0.03%
944,Texas St Univ Sys Fing Rev 5.0% 15-MAR-2023,0.03%
945,Lubbock Tex 5.0% 15-FEB-2023,0.03%
946,Indiana St Fin Auth Rev 5.0% 01-FEB-2023,0.03%
947,Clark Cnty Wash Pub Util Dist No 001 Elec Rev 5.0% 01-JAN-2023,0.03%
948,Alabama St Pub Sch & College Auth 3.0% 01-JUN-2023,0.03%
949,Massachusetts St 5.0% 01-DEC-2023,0.03%
950,West Virginia St 5.0% 01-NOV-2023,0.03%
951,Orlando Fla Cap Impt Spl Rev 5.0% 01-OCT-2023,0.03%
952,Minnesota St 5.0% 01-AUG-2023,0.02%
953,Round Rock Tex 5.0% 15-AUG-2023,0.02%
954,Eugene Ore Elec Util Rev 5.0% 01-AUG-2023,0.02%
955,Florida St Brd Ed Pub Ed 5.0% 01-JUN-2023,0.02%
956,Florida St Brd Ed Pub Ed 5.0% 01-JUN-2023,0.02%
957,Arizona Brd Regents Univ Ariz Sys Rev 5.0% 01-AUG-2023,0.02%
958,Iowa City Iowa Cmnty Sch Dist Sch Infrastructuresales Svcs & Use Tax Rev 5.0% 01-JUN-2023,0.02%
959,Indiana St Fin Auth Rev 5.0% 01-FEB-2023,0.02%
960,Port Seattle Wash 5.0% 01-JAN-2023,0.02%
961,Wisconsin St 4.0% 01-MAY-2023,0.02%
962,Leander Tex Indpt Sch Dist 0.0% 15-AUG-2023,0.02%
963,Metropolitan Transn Auth N Y Rev 5.0% 15-NOV-2023,0.02%
964,King Cnty Wash Sch Dist No 216 Enumclaw 5.0% 01-DEC-2023,0.02%
965,Hawaii St 5.0% 01-OCT-2023,0.02%
966,Hawaii St 5.0% 01-OCT-2023,0.02%
967,Massachusetts St Wtr Res Auth 5.0% 01-AUG-2023,0.02%
968,Oregon St 5.0% 01-AUG-2023,0.02%
969,Rhode Island St & Providence Plantations 5.0% 01-AUG-2023,0.02%
970,Rhode Island St & Providence Plantations 5.0% 01-AUG-2023,0.02%
971,Trinity River Auth Tex Regl Wastewtr Sys Rev 5.0% 01-AUG-2023,0.02%
972,Austin Tex Indpt Sch Dist 5.0% 01-AUG-2023,0.02%
973,Hawaii St 5.0% 01-AUG-2023,0.02%
974,Michigan Fin Auth Rev 5.0% 15-NOV-2023,0.02%
975,Phoenix Ariz Civic Impt Corp Wtr Sys Rev 5.0% 01-JUL-2023,0.02%
976,Missouri St Environmental Impt & Energy Res Authwtr Pollutn Ctl & Drinking Wtrrev 5.0% 01-JUL-2023,0.02%
977,Seattle Wash Drain & Wastewater Rev 5.0% 01-JUL-2023,0.02%
978,Maricopa Cnty Ariz Uni Sch Dist No 48 Scottsdale 5.0% 01-JUL-2023,0.02%
979,Phoenix Ariz Civic Impt Corp Excise Tax Rev 5.0% 01-JUL-2023,0.02%
980,Phoenix Ariz Civic Impt Corp Wastewater Sys Rev 5.0% 01-JUL-2023,0.02%
981,New York N Y 5.0% 01-AUG-2023,0.02%
982,Palm Beach Cnty Fla Sch Brd Ctfs Partn 5.0% 01-AUG-2023,0.02%
983,Orange Cnty Fla Sch Brd Ctfs Partn 5.0% 01-AUG-2023,0.02%
984,Austin Tex Cmnty College Dist 5.0% 01-AUG-2023,0.02%
985,Cape Fear Pub Util Auth N C Wtr & Swr Sys Rev 5.0% 01-JUN-2023,0.02%
986,San Antonio Tex Wtr Rev 5.0% 15-MAY-2023,0.02%
987,New York St Dorm Auth Revs Non St Supported Debt 5.0% 01-OCT-2023,0.02%
988,San Diego Calif Pub Facs Fing Auth Lease Rev 5.0% 15-OCT-2023,0.02%
989,Riverside Cnty Calif Transn Commn Sales Tax Rev 5.0% 01-JUN-2023,0.02%
990,Broward Cnty Fla Sch Brd Ctfs Partn 5.0% 01-JUL-2023,0.02%
991,Keller Tex Indpt Sch Dist 5.0% 15-FEB-2023,0.02%
992,Delaware St 5.0% 01-FEB-2023,0.02%
993,Humble Tex Indpt Sch Dist 5.0% 15-FEB-2023,0.02%
994,Washington St 5.0% 01-FEB-2023,0.02%
995,New York N Y 5.0% 01-MAR-2023,0.02%
996,Kansas City Mo 5.0% 01-FEB-2023,0.02%
997,Madison Wis Wtr Util Rev 5.0% 01-JAN-2023,0.02%
998,New York N Y 4.0% 01-AUG-2023,0.02%
999,New Jersey Economic Dev Auth Rev 5.0% 15-JUN-2023,0.02%
1000,New Jersey St Transn Tr Fd Auth 5.0% 15-JUN-2023,0.02%
1001,New York St Dorm Auth St Pers Income Tax Rev 4.0% 15-MAR-2023,0.02%
1002,University Houston Tex Univ Revs 4.0% 15-FEB-2023,0.02%
1003,Illinois St 5.0% 01-DEC-2023,0.02%
1004,University Conn 4.0% 15-FEB-2023,0.02%
1005,Chicago Ill O Hare Intl Arpt Rev 4.125% 01-JAN-2023,0.02%
1006,Sumner Cnty Tenn 5.0% 01-DEC-2023,0.02%
1007,Oregon St 5.0% 01-NOV-2023,0.02%
1008,Massachusetts St Sch Bldg Auth Dedicated Sales Tax Rev 5.0% 15-NOV-2023,0.02%
1009,Texas St 5.0% 01-AUG-2023,0.02%
1010,Kansas St Dept Transn Hwy Rev 5.0% 01-SEP-2023,0.02%
1011,Florida St Brd Ed Pub Ed 5.0% 01-JUN-2023,0.02%
1012,Massachusetts St Transn Fd Rev 5.0% 01-JUN-2023,0.02%
1013,Illinois St Sales Tax Rev 6.0% 15-JUN-2023,0.02%
1014,Birdville Tex Indpt Sch Dist 5.0% 15-FEB-2023,0.02%
1015,New York St Dorm Auth St Pers Income Tax Rev 5.0% 15-FEB-2023,0.02%
1016,Massachusetts St 5.0% 01-JAN-2023,0.02%
1017,Oklahoma St Capitol Impt Auth St Facs Rev 5.0% 01-JAN-2023,0.02%
1018,New Jersey St Transn Tr Fd Auth 5.0% 15-JUN-2023,0.02%
1019,Leander Tex Indpt Sch Dist 0.0% 15-AUG-2023,0.02%
1020,Newport-Mesa Calif Uni Sch Dist 0.0% 01-AUG-2023,0.02%
1021,Las Virgenes Calif Uni Sch Dist 0.0% 01-NOV-2023,0.02%
1022,Alameda Calif Uni Sch Dist Alameda Cnty 0.0% 01-AUG-2023,0.02%
1023,Cincinnati Ohio Wtr Sys Rev 5.0% 01-DEC-2023,0.02%
1024,Charlotte N C Ctfs Partn 5.0% 01-DEC-2023,0.02%
1025,Los Angeles Calif Mun Impt Corp Lease Rev 5.0% 01-NOV-2023,0.02%
1026,Tennessee St Sch Bd Auth 5.0% 01-NOV-2023,0.02%
1027,Orlando Fla Utils Commn Util Sys Rev 5.0% 01-OCT-2023,0.02%
1028,Orlando Fla Utils Commn Util Sys Rev 5.0% 01-OCT-2023,0.02%
1029,Ohio State 5.0% 15-SEP-2023,0.02%
1030,Wisconsin St Health & Edl Facs Auth Rev 5.0% 15-NOV-2023,0.02%
1031,Tarrant Cnty Tex Cultural Ed Facs Fin Corp Hosprev 5.0% 01-DEC-2023,0.02%
1032,Coast Cmnty College Dist Calif 5.0% 01-AUG-2023,0.02%
1033,Washington Subn San Dist Md 5.0% 01-JUN-2023,0.02%
1034,Broward Cnty Fla Arpt Sys Rev 5.0% 01-OCT-2023,0.02%
1035,Nevada Sys Higher Ed Ctfs Partn 5.0% 01-JUL-2023,0.02%
1036,New Mexico St Severance Tax 5.0% 01-JUL-2023,0.02%
1037,Austin Tex Wtr & Wastewater Sys Rev 5.0% 15-MAY-2023,0.02%
1038,Wisconsin St 5.0% 01-MAY-2023,0.02%
1039,Michigan St Bldg Auth Rev 5.0% 15-APR-2023,0.02%
1040,Maricopa Cnty Ariz Uni Sch Dist No 80 Chandler 4.5% 01-JUL-2023,0.02%
1041,Washoe Cnty Nev Sch Dist 5.0% 01-JUN-2023,0.02%
1042,Forsyth Cnty Ga 5.0% 01-MAR-2023,0.02%
1043,Birdville Tex Indpt Sch Dist 5.0% 15-FEB-2023,0.02%
1044,Richmond Va Pub Util Rev 5.0% 15-JAN-2023,0.02%
1045,Honolulu Hawaii City & Cnty 4.0% 01-SEP-2023,0.02%
1046,Delaware Riv & Bay Auth Del Rev 5.0% 01-JAN-2023,0.02%
1047,Chicago Ill O Hare Intl Arpt Rev 5.0% 01-JAN-2023,0.02%
1048,Chicago Ill O Hare Intl Arpt Rev 5.0% 01-JAN-2023,0.02%
1049,Loudoun Cnty Va 5.0% 01-DEC-2023,0.02%
1050,Tallahassee Fla Cons Util Sys Rev 5.0% 01-OCT-2023,0.02%
1051,Indiana Fin Auth Hosp Rev 5.0% 01-DEC-2023,0.02%
1052,Norfolk Va 5.0% 01-AUG-2023,0.02%
1053,New York N Y 5.0% 01-AUG-2023,0.02%
1054,New York N Y 5.0% 01-AUG-2023,0.02%
1055,Mesa Ariz Util Sys Rev 5.0% 01-JUL-2023,0.02%
1056,Florida St Brd Ed Pub Ed 5.0% 01-JUN-2023,0.02%
1057,Texas A & M Univ Revs 5.0% 15-MAY-2023,0.02%
1058,Michigan St 5.0% 01-MAY-2023,0.02%
1059,Pennsylvania St Tpk Commn Tpk Rev 5.0% 01-DEC-2023,0.02%
1060,Louisiana St 5.0% 01-APR-2023,0.02%
1061,Cypress-Fairbanks Tex Indpt Sch Dist 5.0% 15-FEB-2023,0.02%
1062,Lewisville Tex Indpt Sch Dist 4.0% 15-AUG-2023,0.02%
1063,Miami-Dade Cnty Fla Sch Brd Ctfs Partn 5.0% 01-FEB-2023,0.02%
1064,Grant Cnty Wash Pub Util Dist No 2 Priest Rapidshydro Elec Rev 5.0% 01-JAN-2023,0.02%
1065,Arkansas St 4.25% 01-JUN-2023,0.02%
1066,Arizona Health Facs Auth Rev 5.0% 01-JAN-2023,0.02%
1067,San Diego Calif Cmnty College Dist 0.0% 01-AUG-2023,0.01%
1068,Minnesota St Mun Pwr Agy Elec Rev 5.0% 01-OCT-2023,0.01%
1069,San Diego Calif Uni Sch Dist 5.0% 01-JUL-2023,0.01%
1070,Portland Ore Cmnty College Dist 5.0% 15-JUN-2023,0.01%
1071,Ohio State 5.0% 01-MAR-2023,0.01%
1072,Kansas St Dev Fin Auth Rev 5.0% 01-MAY-2023,0.01%
1073,Irvine Ranch Calif Wtr Dist 5.0% 01-FEB-2023,0.01%
1074,Baltimore Cnty Md 5.0% 01-FEB-2023,0.01%
1075,Mecklenburg Cnty N C 5.0% 01-DEC-2023,0.01%
1076,Vermont Mun Bd Bk 5.0% 01-DEC-2023,0.01%
1077,Snohomish Cnty Wash 5.0% 01-DEC-2023,0.01%
1078,Houston Tex Util Sys Rev 5.0% 15-NOV-2023,0.01%
1079,Skagit Cnty Wash Sch Dist No 103 Anacortes 5.0% 01-DEC-2023,0.01%
1080,King Cnty Was Sch Dist No 401 Highline 5.0% 01-DEC-2023,0.01%
1081,Rochester Minn Elec Util Rev 5.0% 01-DEC-2023,0.01%
1082,Rhode Is Infrastructure Bk Wtr Pollution Ctl Rev 5.0% 01-OCT-2023,0.01%
1083,California Health Facs Fing Auth Rev 5.0% 15-NOV-2023,0.01%
1084,Seattle Wash Mun Lt & Pwr Rev 5.0% 01-SEP-2023,0.01%
1085,Prince Georges Cnty Md Ctfs Partn 5.0% 15-OCT-2023,0.01%
1086,Lewisville Tex Indpt Sch Dist 5.0% 15-AUG-2023,0.01%
1087,University Tex Univ Revs 5.0% 15-AUG-2023,0.01%
1088,Virginia St Pub Sch Auth 5.0% 01-AUG-2023,0.01%
1089,United Indpt Sch Dist Tex 5.0% 15-AUG-2023,0.01%
1090,Laredo Tex Indpt Sch Dist 5.0% 01-AUG-2023,0.01%
1091,Virginia St Pub Sch Auth Spl Oblig Prince William Cnty 5.0% 15-JUL-2023,0.01%
1092,Florida St Tpk Auth Tpk Rev 5.0% 01-JUL-2023,0.01%
1093,Miami-Dade Cnty Fla 5.0% 01-JUL-2023,0.01%
1094,Northside Tex Indpt Sch Dist 5.0% 15-JUN-2023,0.01%
1095,University Tex Perm Univ Fd 5.0% 01-JUL-2023,0.01%
1096,Florida St Brd Ed Lottery Rev 5.0% 01-JUL-2023,0.01%
1097,Maine St 5.0% 01-JUN-2023,0.01%
1098,University Vt & St Agric College 5.0% 01-OCT-2023,0.01%
1099,Louisiana St Hwy Impt Rev 5.0% 15-JUN-2023,0.01%
1100,San Jose Calif Fing Auth Lease Rev 5.0% 01-JUN-2023,0.01%
1101,Ohio St 5.0% 01-FEB-2023,0.01%
1102,New York N Y City Transitional Fin Auth Rev 5.0% 01-FEB-2023,0.01%
1103,Metropolitan Govt Nashville & Davidson Cnty Tenn 5.0% 01-JAN-2029,0.01%
1104,Columbus Ohio 4.0% 01-JUL-2023,0.01%
1105,New York Convention Ctr Dev Corp N Y Rev 5.0% 15-NOV-2023,0.01%
1106,Metropolitan Transn Auth N Y Rev 5.0% 15-NOV-2023,0.01%
1107,Illinois St Sales Tax Rev 4.0% 15-JUN-2023,0.01%
1108,Hamilton Cnty Ohio Swr Sys Rev 5.0% 01-DEC-2023,0.01%
1109,Pierce Cnty Wash Sch Dist No 416 White Riv 5.0% 01-DEC-2023,0.01%
1110,Michigan St 5.0% 01-NOV-2023,0.01%
1111,Virginia St Res Auth Clean Wtr Rev 5.0% 01-OCT-2023,0.01%
1112,Texas St Technical College Sys 5.0% 15-OCT-2023,0.01%
1113,Honolulu Hawaii City & Cnty 5.0% 01-OCT-2023,0.01%
1114,Harris Cnty Tex Met Tran Auth Sales & Use Tax 5.0% 01-NOV-2023,0.01%
1115,Tri-Cnty Met Transn Dist Ore Rev 5.0% 01-SEP-2023,0.01%
1116,California St Pub Wks Brd Lease Rev 5.0% 01-SEP-2023,0.01%
1117,Leander Tex Indpt Sch Dist 5.0% 15-AUG-2023,0.01%
1118,Los Angeles Calif Cmnty College Dist 5.0% 01-AUG-2023,0.01%
1119,Mt Diablo Calif Uni Sch Dist 5.0% 01-AUG-2023,0.01%
1120,Volusia Cnty Fla Sch Brd Ctfs Partn 5.0% 01-AUG-2023,0.01%
1121,Leander Tex Indpt Sch Dist 5.0% 15-AUG-2023,0.01%
1122,Purdue Univ Ind Univ Revs 5.0% 01-JUL-2023,0.01%
1123,Winston-Salem N C Ltd Oblig 5.0% 01-JUN-2023,0.01%
1124,New Mexico St Severance Tax 5.0% 01-JUL-2023,0.01%
1125,Seminole Cnty Fla Sch Brd Ctfs Partn 5.0% 01-JUL-2023,0.01%
1126,District Columbia Hosp Rev 5.0% 15-JUL-2023,0.01%
1127,Pasco Cnty Fla Sch Brd Ctfs Partn 5.0% 01-AUG-2023,0.01%
1128,Snohomish Cnty Wash Sch Dist No 015 Edmonds 4.0% 01-DEC-2023,0.01%
1129,Rancho Santiago Calif Cmnty College Dist 4.0% 01-SEP-2023,0.01%
1130,Waco Tex 5.0% 01-FEB-2023,0.01%
1131,Sedgwick Cnty Kans Uni Sch Dist No 259 Wichita 4.0% 01-OCT-2023,0.01%
1132,New York Convention Ctr Dev Corp N Y Rev 5.0% 15-NOV-2023,0.01%
1133,San Mateo Calif Un High Sch Dist 0.0% 01-SEP-2023,0.01%
1134,Yakima Cnty Wash Sch Dist No 90 East Valley 5.0% 01-DEC-2023,0.01%
1135,University Ark Univ Rev 5.0% 01-NOV-2023,0.01%
1136,California St 5.0% 01-SEP-2023,0.01%
1137,California Health Facs Fing Auth Rev 5.0% 15-NOV-2023,0.01%
1138,California St Pub Wks Brd Lease Rev 5.25% 01-JUN-2023,0.01%
1139,Metropolitan Govt Nashville & Davidson Cnty Tennelec Rev 5.0% 15-MAY-2023,0.01%
1140,Ohio St 5.0% 01-APR-2023,0.01%
1141,North Carolina Med Care Commn Health Care Facs Rev 5.0% 01-JUN-2023,0.01%
1142,Massachusetts St Sch Bldg Auth Dedicated Sales Tax Rev 4.0% 15-AUG-2023,0.01%
1143,Charles Cnty Md 5.0% 01-NOV-2023,0.00%
1144,Hampton Va 5.0% 01-SEP-2023,0.00%
1145,Connecticut St 5.0% 01-SEP-2023,0.00%
1146,Clark Cnty Nev Hwy Impt Rev 5.0% 01-JUL-2023,0.00%
1147,Metropolitan Transn Auth N Y Dedicated Tax Fd 5.0% 15-NOV-2023,0.00%
1148,New Jersey St Tpk Auth Tpk Rev 5.0% 01-JAN-2023,0.00%
1149,North Carolina Mun Pwr Agy No 1 Catawba Elec Rev 5.0% 01-JAN-2023,0.00%
