,Name,Allocation
0,Wisconsin St 5.0% 01-MAY-2029,0.90%
1,Salt Lake Cnty Utah Excise Tax Rd Rev 5.0% 15-AUG-2030,0.79%
2,California St 5.0% 01-AUG-2023,0.69%
3,University Calif Revs VAR 15-MAY-2048,0.63%
4,Metropolitan Govt Nashville & Davidson Cnty Tenn 5.0% 01-JAN-2033,0.55%
5,Virginia Comwlth Transn Brd 5.0% 15-SEP-2023,0.49%
6,University Utah Univ Revs 5.0% 01-AUG-2027,0.49%
7,New York N Y 5.0% 01-AUG-2023,0.48%
8,Virginia College Bldg Auth Va Edl Facs Rev 5.0% 01-FEB-2028,0.46%
9,Chesapeake Bay Brdg & Tunl Dist Va Rev 5.0% 01-NOV-2023,0.45%
10,Wisconsin St 5.0% 01-MAY-2028,0.45%
11,Georgia St 5.0% 01-JAN-2023,0.44%
12,Los Angeles Calif Uni Sch Dist 5.0% 01-JUL-2023,0.43%
13,Maryland St Dept Transn Cons Transn 5.0% 01-OCT-2023,0.42%
14,Goose Creek Tex Cons Indpt Sch Dist 5.0% 15-FEB-2028,0.40%
15,Metropolitan Govt Nashville & Davidson Cnty Tenn 5.0% 01-JUL-2023,0.40%
16,Illinois St 5.0% 01-NOV-2023,0.37%
17,Pennsylvania St 5.0% 15-AUG-2023,0.37%
18,Maryland St 5.0% 01-AUG-2023,0.36%
19,Indiana Fin Auth Hwy Rev 5.0% 01-DEC-2023,0.36%
20,Georgia St 5.0% 01-JUL-2023,0.36%
21,California St 5.0% 01-SEP-2023,0.36%
22,Massachusetts St 5.0% 01-NOV-2023,0.35%
23,New Jersey Economic Dev Auth Rev 5.0% 01-MAR-2023,0.35%
24,New York St Dorm Auth Sales Tax Rev St Supporteddebt 5.0% 15-MAR-2023,0.35%
25,New York N Y City Mun Wtr Fin Auth Wtr & Swr Sysrev 5.0% 15-JUN-2023,0.34%
26,New York St Dorm Auth St Pers Income Tax Rev 5.0% 15-FEB-2023,0.33%
27,New York St Urban Dev Corp Rev 5.0% 15-MAR-2023,0.33%
28,Minnesota St 5.0% 01-AUG-2023,0.33%
29,Fairfax Cnty Va 5.0% 01-OCT-2023,0.32%
30,University Mich Univ Revs 5.0% 01-APR-2023,0.31%
31,Guilford Cnty N C 5.0% 01-MAY-2023,0.31%
32,Union Cnty N C 5.0% 01-SEP-2023,0.30%
33,Michigan St Bldg Auth Rev 5.0% 15-APR-2023,0.30%
34,Texas St 5.0% 01-OCT-2023,0.30%
35,Lewisville Tex Indpt Sch Dist 5.0% 15-AUG-2023,0.30%
36,Nevada St 5.0% 01-MAR-2023,0.29%
37,Wisconsin St Transn Rev 5.0% 01-JUL-2026,0.29%
38,Metropolitan Transn Auth N Y Rev 5.0% 15-NOV-2023,0.29%
39,Texas Transn Commn St Hwy Fd Rev 5.0% 01-OCT-2023,0.29%
40,Omaha Pub Pwr Dist Neb Elec Rev 5.0% 01-FEB-2023,0.29%
41,Miami-Dade Cnty Fla Wtr & Swr Rev 5.0% 01-OCT-2023,0.29%
42,New York N Y 5.0% 01-AUG-2023,0.28%
43,California St 5.0% 01-NOV-2023,0.28%
44,Delaware St 5.0% 01-MAR-2023,0.28%
45,Massachusetts St 5.0% 01-JUL-2023,0.28%
46,Wisconsin St Transn Rev 5.0% 01-JUL-2027,0.28%
47,Northeast Ohio Regl Swr Dist Wastewtr Rev 5.0% 15-NOV-2028,0.28%
48,New York St Urban Dev Corp Rev 5.0% 15-MAR-2023,0.27%
49,Illinois St 5.0% 01-MAY-2023,0.27%
50,New Mexico St 5.0% 01-MAR-2023,0.27%
51,Maryland St 5.0% 01-JUN-2023,0.27%
52,King Cnty Wash Sch Dist No 405 Bellevue 5.0% 01-DEC-2023,0.26%
53,University Utah Univ Revs 5.0% 01-AUG-2028,0.26%
54,West Virginia St 5.0% 01-JUN-2023,0.25%
55,Missouri St Hwys & Trans Commn St Rd Rev 5.0% 01-FEB-2023,0.25%
56,North Carolina St 5.0% 01-JUN-2023,0.25%
57,Phoenix Ariz 4.0% 01-JUL-2023,0.25%
58,Salt Riv Proj Agric Impt & Pwr Dist Ariz Elec Sys Rev 5.0% 01-JAN-2023,0.25%
59,Virginia College Bldg Auth Va Edl Facs Rev 5.0% 01-FEB-2023,0.25%
60,Cuero Tex Indpt Sch Dist 5.0% 15-AUG-2030,0.24%
61,Pennsylvania St 5.0% 01-JAN-2023,0.24%
62,Clark Cnty Nev 5.0% 01-NOV-2023,0.24%
63,Maryland St 5.0% 01-AUG-2023,0.24%
64,Florida St Brd Ed Lottery Rev 5.0% 01-JUL-2023,0.24%
65,Pennsylvania St 5.0% 15-OCT-2023,0.24%
66,Hawaii St 5.0% 01-AUG-2023,0.23%
67,Wisconsin St Environmental Impt Fd Rev 5.0% 01-JUN-2023,0.23%
68,Massachusetts St 5.5% 01-DEC-2023,0.23%
69,New York N Y 5.0% 01-AUG-2023,0.23%
70,Montgomery Cnty Md 5.0% 01-DEC-2023,0.23%
71,Gwinnett Cnty Ga Wtr & Sew Auth Rev 5.0% 01-AUG-2023,0.23%
72,Clark Cnty Nev Hwy Impt Rev 5.0% 01-JUL-2023,0.23%
73,Hampton Roads Santn Dist Va Wastewater Rev 5.0% 01-JUL-2023,0.23%
74,Ohio St 5.0% 01-MAY-2023,0.22%
75,Oregon St 5.0% 01-MAY-2023,0.22%
76,Kansas City Mo 5.0% 01-FEB-2023,0.22%
77,Minnesota St 5.0% 01-AUG-2023,0.22%
78,Virginia St 4.0% 01-JUN-2023,0.22%
79,Columbus Ohio 4.0% 01-APR-2023,0.22%
80,Los Angeles Calif Uni Sch Dist 4.0% 01-JUL-2023,0.22%
81,Washington Fed Hwy Grnt Antic Rev 5.0% 01-SEP-2023,0.22%
82,Connecticut St 5.0% 15-OCT-2023,0.22%
83,Wisconsin St Transn Rev 5.0% 01-JUL-2023,0.22%
84,Michigan St 5.0% 15-MAR-2023,0.21%
85,Tennessee St Sch Bd Auth 5.0% 01-NOV-2023,0.21%
86,Texas St Univ Sys Fing Rev 5.0% 15-MAR-2023,0.21%
87,New Jersey Economic Dev Auth Rev 5.0% 01-NOV-2023,0.21%
88,University Tex Univ Revs 5.0% 15-AUG-2023,0.21%
89,New York St Dorm Auth St Pers Income Tax Rev 5.0% 15-FEB-2023,0.21%
90,Miami-Dade Cnty Fla Tran Sys Sales Surtax Rev 5.0% 01-JUL-2023,0.21%
91,Ohio St Wtr Dev Auth Rev 5.0% 01-DEC-2023,0.20%
92,Connecticut St Health & Edl Facs Auth Rev VAR 01-JUL-2048,0.20%
93,Nevada St Hwy Impt Rev 5.0% 01-DEC-2023,0.20%
94,Seattle Wash 5.0% 01-APR-2023,0.20%
95,Wisconsin St 5.0% 01-NOV-2023,0.20%
96,Pima Cnty Ariz Swr Rev 5.0% 01-JUL-2023,0.20%
97,New York St Dorm Auth Sales Tax Rev St Supporteddebt 5.0% 15-MAR-2023,0.20%
98,Minnesota St Gen Fd Rev 5.0% 01-JUN-2023,0.19%
99,Phoenix Ariz Civic Impt Corp Wtr Sys Rev 5.0% 01-JUL-2023,0.19%
100,Energy Northwest Wash Elec Rev 5.0% 01-JUL-2023,0.19%
101,California St 5.0% 01-OCT-2023,0.19%
102,Spring Tex Indpt Sch Dist 5.0% 15-AUG-2023,0.19%
103,Virginia St Pub Bldg Auth Pub Facs Rev 5.0% 01-AUG-2023,0.19%
104,Illinois St 5.0% 01-OCT-2023,0.19%
105,Florida St Dept Environmental Protn Preservationrev 5.0% 01-JUL-2023,0.19%
106,Maryland St 4.0% 01-AUG-2023,0.18%
107,Alabama St 5.0% 01-NOV-2023,0.18%
108,California St Pub Wks Brd Lease Rev 5.0% 01-SEP-2023,0.18%
109,Maine Mun Bd Bk Transn Infrastructure Rev 5.0% 01-SEP-2023,0.18%
110,San Antonio Tex 5.0% 01-FEB-2023,0.18%
111,Tennessee St 5.0% 01-AUG-2023,0.18%
112,Miami-Dade Cnty Fla 5.0% 01-JUL-2023,0.18%
113,Hawaii St 5.0% 01-OCT-2023,0.18%
114,Oregon St Dept Transn Hwy User Tax Rev 5.0% 15-NOV-2023,0.17%
115,King Cnty Wash 5.0% 01-JUL-2023,0.17%
116,Rhode Island St & Providence Plantations 3.0% 01-AUG-2023,0.17%
117,Austin Tex Wtr & Wastewater Sys Rev 5.0% 15-NOV-2023,0.17%
118,New Mexico St Severance Tax 4.0% 01-JUL-2023,0.17%
119,Arlington Tex Indpt Sch Dist 5.0% 15-FEB-2023,0.17%
120,California St 5.0% 01-OCT-2023,0.17%
121,University Tex Univ Revs 5.0% 15-AUG-2023,0.17%
122,University Tex Univ Revs 5.0% 15-AUG-2023,0.17%
123,Metropolitan Transn Auth N Y Rev 5.0% 15-NOV-2023,0.17%
124,Connecticut St Spl Tax Oblig Rev 5.0% 01-OCT-2023,0.17%
125,Washington St 5.0% 01-JUL-2023,0.17%
126,New York N Y 5.0% 01-AUG-2023,0.17%
127,Virginia Comwlth Transn Brd Transn Rev 5.0% 15-MAY-2023,0.17%
128,Alpine Utah Sch Dist 5.0% 15-MAR-2023,0.17%
129,California St 5.0% 01-NOV-2023,0.17%
130,Arizona St Transn Brd Excise Tax Rev 5.0% 01-JUL-2023,0.17%
131,Fairfax Cnty Va 5.0% 01-OCT-2023,0.17%
132,District Columbia Income Tax Rev 5.0% 01-DEC-2023,0.17%
133,Connecticut St 5.0% 15-APR-2023,0.17%
134,Arizona Sch Facs Brd Ctfs Partn 5.0% 01-SEP-2023,0.17%
135,Katy Tex Indpt Sch Dist 5.0% 15-FEB-2023,0.16%
136,Honolulu Hawaii City & Cnty 5.0% 01-SEP-2023,0.16%
137,Salt Riv Proj Agric Impt & Pwr Dist Ariz Elec Sys Rev 5.0% 01-JAN-2023,0.16%
138,New York N Y 5.0% 01-AUG-2023,0.16%
139,Lower Colo Riv Auth Tex Rev 5.0% 15-MAY-2023,0.16%
140,Florida St Tpk Auth Tpk Rev 5.0% 01-JUL-2023,0.16%
141,Georgia St 5.0% 01-FEB-2023,0.16%
142,District Columbia 5.0% 01-JUN-2023,0.16%
143,Connecticut St Health & Edl Facs Auth Rev VAR 01-JUL-2057,0.16%
144,Rhode Is Infrastructure Bk Wtr Pollution Ctl Rev 5.0% 01-OCT-2023,0.16%
145,Arkansas St 5.0% 01-OCT-2023,0.16%
146,Pennsylvania St 5.0% 01-APR-2024,0.16%
147,Rhode Island St Comm Corp Rev 5.0% 15-JUN-2023,0.16%
148,Delaware Transn Auth Transn Sys Rev 5.0% 01-JUL-2023,0.16%
149,Washington St 5.0% 01-FEB-2023,0.16%
150,Metropolitan Transn Auth N Y Rev 5.0% 15-NOV-2023,0.16%
151,North Tex Mun Wtr Dist Tex Wtr Sys Rev 5.0% 01-SEP-2023,0.15%
152,Massachusetts Bay Transportation Authority 5.25% 01-JUL-2023,0.15%
153,Kansas St Dept Transn Hwy Rev 5.0% 01-SEP-2023,0.15%
154,Massachusetts St Fed Hwy 5.0% 15-JUN-2023,0.15%
155,Florida St Brd Ed Pub Ed 5.0% 01-JUN-2023,0.15%
156,Grand River Dam Auth Okla Rev 5.0% 01-JUN-2023,0.15%
157,Ohio St 5.0% 01-MAY-2023,0.15%
158,Oregon St Dept Administrative Svcs Lottery Rev 5.0% 01-APR-2023,0.15%
159,Austin Tex Indpt Sch Dist 5.0% 01-AUG-2023,0.15%
160,King Cnty Wash Swr Rev 5.0% 01-JUL-2023,0.15%
161,Chicago Ill O Hare Intl Arpt Rev 5.0% 01-JAN-2023,0.15%
162,California St Pub Wks Brd Lease Rev 5.0% 01-OCT-2023,0.15%
163,Connecticut St 5.0% 15-MAY-2023,0.15%
164,Montgomery Cnty Md 5.0% 01-DEC-2023,0.15%
165,Lone Star College Sys Tex 5.0% 15-FEB-2023,0.15%
166,New York St Dorm Auth St Pers Income Tax Rev 5.0% 15-FEB-2023,0.15%
167,Virginia St Pub Sch Auth Sch Fing 5.0% 01-AUG-2023,0.15%
168,Wisconsin St 5.0% 01-NOV-2023,0.15%
169,North Carolina St Grant Antic Rev 5.0% 01-MAR-2023,0.15%
170,Hawaii St 5.0% 01-AUG-2030,0.15%
171,Oregon St Business Dev Commn Rev VAR 01-DEC-2040,0.15%
172,North Carolina St 5.0% 01-JUN-2023,0.15%
173,San Antonio Tex Elec & Gas Rev 5.0% 01-FEB-2023,0.15%
174,MUNICIPAL BONDS,0.15%
175,Massachusetts St Sch Bldg Auth Dedicated Sales Tax Rev 5.0% 15-MAY-2038,0.15%
176,Hawaii St 5.0% 01-AUG-2023,0.15%
177,New York St Urban Dev Corp Rev 5.0% 15-MAR-2023,0.14%
178,New York St Dorm Auth St Pers Income Tax Rev 5.0% 15-FEB-2023,0.14%
179,Illinois St 5.0% 01-AUG-2023,0.14%
180,District Columbia 5.0% 01-JUN-2023,0.14%
181,Houston Tex Indpt Sch Dist 5.0% 15-FEB-2023,0.14%
182,Baltimore Cnty Md 5.0% 01-FEB-2023,0.14%
183,Oklahoma Cap Imp Auth St Hwy Cap Impt Rev 5.0% 01-JUL-2023,0.14%
184,Harris Cnty Tex Met Tran Auth Sales & Use Tax 5.0% 01-NOV-2023,0.14%
185,Pennsylvania St Tpk Commn Tpk Rev 5.0% 01-DEC-2023,0.14%
186,Fairfax Cnty Va Wtr Auth Wtr Rev 5.0% 01-APR-2023,0.14%
187,Alabama Fed Aid Hwy Fin Auth Spl Oblig Rev 5.0% 01-SEP-2023,0.14%
188,New York St Dorm Auth Revs Non St Supported Debt 5.0% 01-JUL-2023,0.14%
189,Washington St Univ Revs 5.0% 01-APR-2023,0.14%
190,Loudoun Cnty Va 5.0% 01-DEC-2023,0.14%
191,Hawaii St 5.0% 01-OCT-2023,0.14%
192,Pima Cnty Ariz 4.0% 01-JUL-2023,0.14%
193,North Tex Twy Auth Rev 5.0% 01-JAN-2023,0.14%
194,Pennsylvania St 5.0% 15-SEP-2023,0.14%
195,Tarrant Regl Wtr Dist Tex Wtr Rev 5.0% 01-MAR-2023,0.14%
196,Washington St 5.0% 01-JUL-2023,0.14%
197,Spokane Wash Wtr & Wastewater Sys Rev 5.0% 01-DEC-2023,0.14%
198,Honolulu Hawaii City & Cnty Wastewtr Sys Rev 5.0% 01-JUL-2023,0.14%
199,San Antonio Tex Elec & Gas Rev 5.0% 01-FEB-2023,0.14%
200,Port Auth N Y & N J 5.0% 15-JUL-2023,0.14%
201,Florida St Brd Ed Pub Ed 5.0% 01-JUN-2023,0.14%
202,Maryland St Dept Transn Cons Transn 4.0% 01-SEP-2023,0.14%
203,Las Vegas Vy Nev Wtr Dist 5.0% 01-JUN-2023,0.14%
204,Virginia St Res Auth Clean Wtr Rev 5.0% 01-OCT-2023,0.13%
205,Montgomery Cnty Md 5.0% 01-OCT-2023,0.13%
206,Mecklenburg Cnty N C Ltd Oblig 5.0% 01-OCT-2023,0.13%
207,Metro Wastewtr Reclamation Dist Colo Swr Rev 5.0% 01-APR-2023,0.13%
208,Seattle Wash Mun Lt & Pwr Rev 5.0% 01-APR-2023,0.13%
209,New Jersey Economic Dev Auth Rev 5.0% 15-JUN-2023,0.13%
210,Clark Cnty Nev Sch Dist 5.0% 15-JUN-2023,0.13%
211,Clark Cnty Nev Sch Dist 5.0% 15-JUN-2023,0.13%
212,Georgia St 5.0% 01-FEB-2023,0.13%
213,Arizona Brd Regents Ariz St Univ Sys Rev 5.0% 01-JUL-2023,0.13%
214,Alabama St 5.0% 01-NOV-2023,0.13%
215,North Tex Twy Auth Rev 5.0% 01-JAN-2023,0.13%
216,New Jersey St Transn Tr Fd Auth 5.0% 15-JUN-2023,0.13%
217,New York N Y City Transitional Fin Auth Rev 5.0% 01-AUG-2023,0.13%
218,Baltimore Md Rev 5.0% 01-JUL-2023,0.13%
219,Ohio St Tpk Commn Tpk Rev 5.0% 15-FEB-2023,0.13%
220,Massachusetts St 5.0% 01-JUL-2023,0.13%
221,New York St Dorm Auth St Pers Income Tax Rev 5.0% 15-FEB-2023,0.13%
222,Dallas Tex Area Rapid Tran Sales Tax Rev 5.0% 01-DEC-2023,0.13%
223,Rhode Is Infrastructure Bk Wtr Pollution Ctl Rev 5.0% 01-OCT-2023,0.13%
224,Milwaukee Wis Met Sew Dist 5.0% 01-OCT-2023,0.13%
225,University Utah Univ Revs 5.0% 01-AUG-2023,0.12%
226,California St 5.0% 01-AUG-2023,0.12%
227,Metropolitan Govt Nashville & Davidson Cnty Tenn 5.0% 01-JUL-2023,0.12%
228,Delaware Transn Auth Transn Sys Rev 5.0% 01-JUL-2023,0.12%
229,North Tex Twy Auth Rev 5.0% 01-JAN-2023,0.12%
230,Columbus Ohio 5.0% 15-AUG-2023,0.12%
231,Maryland St 5.0% 01-MAR-2023,0.12%
232,Plano Tex Indpt Sch Dist 5.0% 15-FEB-2023,0.12%
233,Illinois Fin Auth Rev 5.0% 01-DEC-2023,0.12%
234,Las Vegas Vy Nev Wtr Dist 5.0% 01-JUN-2023,0.12%
235,California St Univ Rev 5.0% 01-NOV-2023,0.12%
236,Alabama Fed Aid Hwy Fin Auth Spl Oblig Rev 5.0% 01-SEP-2023,0.12%
237,Tennessee St 5.0% 01-AUG-2023,0.12%
238,Washington St 5.0% 01-AUG-2023,0.12%
239,Maryland St Dept Transn Cons Transn 5.0% 15-FEB-2023,0.12%
240,Milwaukee Wis 5.0% 01-FEB-2023,0.12%
241,Houston Tex Cmnty College Sys 5.0% 15-FEB-2023,0.12%
242,New York N Y 5.0% 01-AUG-2023,0.12%
243,Iowa St Spl Oblig 5.0% 01-JUN-2023,0.12%
244,Orange Cnty Fla Tourist Dev Tax Rev 5.0% 01-OCT-2023,0.12%
245,Wisconsin St Gen Fd Annual Appropriation Rev 5.0% 01-MAY-2023,0.12%
246,Arizona St Ctfs Partn 5.0% 01-SEP-2023,0.12%
247,Los Angeles Calif Uni Sch Dist 5.0% 01-JUL-2023,0.12%
248,Energy Northwest Wash Elec Rev 5.0% 01-JUL-2023,0.12%
249,King Cnty Wash Sch Dist No 411 Issaquah 5.0% 01-DEC-2023,0.12%
250,Bexar Cnty Tex 5.0% 15-JUN-2023,0.12%
251,MUTUAL FUND (OTHER),0.12%
252,West Va Pkwys Auth Tpk Toll Rev 5.0% 01-JUN-2023,0.12%
253,Sales Tax Asset Receivable Corp N Y 5.0% 15-OCT-2023,0.12%
254,Arkansas St 5.0% 01-APR-2023,0.12%
255,Clark Cnty Nev Sch Dist 5.0% 15-JUN-2023,0.12%
256,Iowa Fin Auth Rev 5.0% 01-AUG-2023,0.12%
257,Denver Colo City & Cnty Arpt Rev 5.0% 15-NOV-2023,0.12%
258,Florida St Tpk Auth Tpk Rev 5.0% 01-JUL-2023,0.12%
259,Honolulu Hawaii City & Cnty Wastewtr Sys Rev 5.0% 01-JUL-2023,0.12%
260,Washington Subn San Dist Md 5.0% 01-JUN-2023,0.12%
261,Houston Tex Util Sys Rev 5.0% 15-MAY-2023,0.11%
262,Tennessee St 5.0% 01-SEP-2023,0.11%
263,New York St Twy Auth Gen Rev 5.0% 01-JAN-2023,0.11%
264,Northside Tex Indpt Sch Dist 5.0% 15-AUG-2023,0.11%
265,Maryland St 5.0% 01-AUG-2023,0.11%
266,Falls Church Va 5.0% 15-JUL-2023,0.11%
267,Washington St 5.0% 01-JUL-2023,0.11%
268,Energy Northwest Wash Elec Rev 5.0% 01-JUL-2023,0.11%
269,Florida St 5.0% 01-JUL-2023,0.11%
270,New York St Environmental Facs Corp St Clean Wtr& Drinking Wtr Rev 5.0% 15-JUN-2023,0.11%
271,Maricopa Cnty Ariz Un High Sch Dist No 210 Phoenix 5.0% 01-JUL-2023,0.11%
272,Maine St 5.0% 01-JUN-2023,0.11%
273,Snohomish Cnty Wash Sch Dist No 006 Mukilteo 5.0% 01-DEC-2023,0.11%
274,Texas Water Dev Brd 5.0% 15-APR-2023,0.11%
275,Clark Cnty Nev Passenger Fac Charge Rev 5.0% 01-JUL-2023,0.11%
276,New York N Y City Transitional Fin Auth Rev 5.0% 01-NOV-2023,0.11%
277,Adams Cnty Colo Sch Dist No 001 4.0% 01-DEC-2023,0.11%
278,New York St Dorm Auth Sales Tax Rev St Supporteddebt 5.0% 15-MAR-2023,0.11%
279,Washington St 5.0% 01-FEB-2023,0.11%
280,Great Lakes Wtr Auth Mich Wtr Supply Sys Rev 5.0% 01-JUL-2023,0.11%
281,New York N Y City Transitional Fin Auth Bldg Aidrev 5.0% 15-JUL-2023,0.11%
282,Utah Tran Auth Sales Tax Rev 5.0% 15-JUN-2023,0.11%
283,Ohio St Spl Oblig 5.0% 01-DEC-2023,0.11%
284,San Antonio Tex Wtr Rev 5.0% 15-MAY-2023,0.11%
285,New York St Dorm Auth St Pers Income Tax Rev 5.0% 15-MAR-2023,0.11%
286,New York St Dorm Auth Sales Tax Rev St Supporteddebt 5.0% 15-MAR-2023,0.11%
287,Ohio State 5.0% 01-AUG-2023,0.11%
288,Virginia St Pub Bldg Auth Pub Facs Rev 5.0% 01-AUG-2023,0.11%
289,Frederick Cnty Md 5.0% 01-AUG-2023,0.11%
290,Virginia College Bldg Auth Va Edl Facs Rev 5.0% 01-FEB-2023,0.11%
291,Bryan Tex Indpt Sch Dist 4.0% 15-FEB-2023,0.11%
292,Wisconsin St Transn Rev 5.0% 01-JUL-2030,0.11%
293,California St Dept Wtr Res Cent Vy Proj Rev 5.0% 01-DEC-2023,0.11%
294,University Colo Enterprise Sys Rev 5.0% 01-JUN-2023,0.11%
295,Ohio St Wtr Dev Auth Wtr Pollutn Ctl Rev 5.5% 01-JUN-2023,0.11%
296,Metropolitan Transn Auth N Y Rev 5.0% 15-NOV-2023,0.11%
297,Florida St Dept Environmental Protn Preservationrev 5.0% 01-JUL-2023,0.11%
298,Washington St Ctfs Partn 5.0% 01-JUL-2023,0.11%
299,Arizona St Transn Brd 5.0% 01-JUL-2023,0.11%
300,Monmouth Cnty N J Impt Auth Rev 5.0% 01-DEC-2023,0.11%
301,New York St Dorm Auth Revs Non St Supported Debt 4.0% 01-OCT-2023,0.10%
302,Phoenix Ariz Civic Impt Corp Arpt Rev 5.0% 01-JUL-2023,0.10%
303,Alvin Tex Indpt Sch Dist 5.0% 15-FEB-2023,0.10%
304,Alabama St Pub Sch & College Auth 5.0% 01-FEB-2023,0.10%
305,Los Angeles Cnty Calif Met Transn Auth Sales Taxrev 5.0% 01-JUL-2023,0.10%
306,San Diego Calif Uni Sch Dist 5.0% 01-JUL-2023,0.10%
307,Truckee Meadows Nev Wtr Auth Wtr Rev 5.0% 01-JUL-2023,0.10%
308,Connecticut St Spl Tax Oblig Rev 5.0% 01-AUG-2023,0.10%
309,Massachusetts St 5.25% 01-SEP-2023,0.10%
310,Columbus Ohio 5.0% 15-FEB-2023,0.10%
311,Pennsylvania St Tpk Commn Tpk Rev 5.0% 01-DEC-2023,0.10%
312,Louisiana St 5.0% 01-AUG-2023,0.10%
313,North East Indpt Sch Dist Tex 5.0% 01-AUG-2023,0.10%
314,Clark Cnty Nev Wtr Reclamation Dist 5.0% 01-JUL-2023,0.10%
315,Florida St 5.0% 01-JUL-2023,0.10%
316,New Jersey St Transn Tr Fd Auth 5.0% 15-JUN-2023,0.10%
317,New York St Dorm Auth Sales Tax Rev St Supporteddebt 5.0% 15-MAR-2023,0.10%
318,Virginia College Bldg Auth Va Edl Facs Rev 21Stcenty Colleg E & Equip Prog 5.0% 01-FEB-2023,0.10%
319,University Tex Univ Revs 5.0% 15-AUG-2023,0.10%
320,Allen Tex Indpt Sch Dist 5.0% 15-FEB-2023,0.10%
321,New York St Dorm Auth St Pers Income Tax Rev 5.0% 15-FEB-2023,0.10%
322,Virginia St Pub Bldg Auth Pub Facs Rev 5.0% 01-AUG-2026,0.10%
323,New York N Y 5.0% 01-AUG-2023,0.10%
324,New York N Y City Mun Wtr Fin Auth Wtr & Swr Sysrev 5.0% 15-JUN-2023,0.10%
325,Polk Cnty Iowa 5.0% 01-JUN-2023,0.10%
326,Arizona Brd Regents Ariz St Univ Sys Rev 5.0% 01-JUL-2023,0.10%
327,Mississippi St 5.25% 01-OCT-2023,0.10%
328,Portland Ore Wtr Sys Rev 5.0% 01-APR-2023,0.10%
329,Oklahoma St Wtr Res Brd Revolving Fd Rev 5.0% 01-APR-2023,0.10%
330,Missouri St Brd Pub Bldgs Spl Oblig 4.0% 01-APR-2023,0.10%
331,North East Indpt Sch Dist Tex 5.25% 01-FEB-2023,0.10%
332,Broward Cnty Fla Sch Brd Ctfs Partn 5.0% 01-JUL-2023,0.10%
333,Washington St 5.0% 01-AUG-2023,0.10%
334,Virginia St Pub Bldg Auth Pub Facs Rev 5.0% 01-AUG-2023,0.10%
335,Massachusetts St Wtr Pollutn Abatement Tr 5.0% 01-AUG-2023,0.10%
336,Texas St Tpk Auth Cent Tex Tpk Sys Rev 0.0% 15-AUG-2023,0.10%
337,Washington St Ctfs Partn 5.0% 01-JUL-2023,0.10%
338,Portland Ore Swr Sys Rev 5.0% 15-JUN-2023,0.10%
339,District Columbia 5.0% 01-JUN-2023,0.10%
340,Arizona Brd Regents Univ Ariz Sys Rev 5.0% 01-JUN-2023,0.10%
341,Oklahoma City Okla 5.0% 01-MAR-2023,0.10%
342,California St 4.0% 01-OCT-2023,0.10%
343,Madison Wis 4.0% 01-OCT-2023,0.10%
344,Nebraska Pub Pwr Dist Rev 5.0% 01-JAN-2023,0.10%
345,Grant Cnty Wash Pub Util Dist No 2 Priest Rapidshydro Elec Rev 5.0% 01-JAN-2023,0.10%
346,Alabama St Pub Sch & College Auth 5.0% 01-JAN-2023,0.10%
347,Arizona St Transn Brd Hwy Rev 5.0% 01-JUL-2023,0.09%
348,New York N Y 5.0% 01-AUG-2023,0.09%
349,New York N Y City Transitional Fin Auth Rev 5.0% 01-AUG-2023,0.09%
350,New York St Environmental Facs Corp St Clean Wtr& Drinking Wtr Rev 5.0% 15-JUN-2023,0.09%
351,Florida St Brd Ed Pub Ed 5.0% 01-JUN-2023,0.09%
352,Nevada St 5.0% 01-JUN-2023,0.09%
353,Leander Tex Indpt Sch Dist 0.0% 15-AUG-2023,0.09%
354,Massachusetts St Sch Bldg Auth Dedicated Sales Tax Rev 5.0% 15-MAY-2023,0.09%
355,Ohio St Wtr Dev Auth Wtr Pollutn Ctl Rev 5.0% 01-DEC-2023,0.09%
356,Philadelphia Pa 5.0% 01-AUG-2023,0.09%
357,Massachusetts St 5.0% 01-MAR-2023,0.09%
358,Cypress-Fairbanks Tex Indpt Sch Dist 5.0% 15-FEB-2023,0.09%
359,Alabama Fed Aid Hwy Fin Auth Spl Oblig Rev 5.0% 01-SEP-2023,0.09%
360,Louisiana St 5.0% 01-FEB-2023,0.09%
361,University Utah Univ Revs 5.0% 01-AUG-2023,0.09%
362,Johnson Cnty Kans Wtr Dist No 001 Wtr Rev 5.0% 01-JAN-2023,0.09%
363,Kansas St Dept Transn Hwy Rev 5.0% 01-SEP-2023,0.09%
364,New York St Dorm Auth Revs St Supported Debt 5.5% 15-MAY-2023,0.09%
365,Ohio St Wtr Dev Auth Rev 5.0% 01-JUN-2023,0.09%
366,Illinois St 5.0% 01-APR-2023,0.09%
367,Baltimore Md 5.0% 15-OCT-2023,0.09%
368,Texas Water Dev Brd 5.0% 15-OCT-2023,0.09%
369,Maryland St Dept Transn Cons Transn 5.0% 01-SEP-2023,0.09%
370,Lewisville Tex Indpt Sch Dist 5.0% 15-AUG-2023,0.09%
371,California St Pub Wks Brd Lease Rev 5.0% 01-SEP-2023,0.09%
372,Minnesota St 5.0% 01-AUG-2023,0.09%
373,Tacoma Wash Elec Sys Rev 5.0% 01-JAN-2023,0.09%
374,Denver Colo City & Cnty Arpt Rev 5.0% 15-NOV-2023,0.09%
375,Texas A & M Univ Perm Univ Fd 5.0% 01-JUL-2023,0.09%
376,Illinois Fin Auth Rev 5.0% 01-JUL-2023,0.09%
377,New York N Y City Transitional Fin Auth Bldg Aidrev 5.0% 15-JUL-2023,0.09%
378,Oklahoma St Cap Impt Auth St Agy Fac Rev 5.0% 01-JUL-2023,0.09%
379,Intermountain Pwr Agy Utah Pwr Supply Rev 5.0% 01-JUL-2023,0.09%
380,Maricopa Cnty Ariz Cmnty College Dist 5.0% 01-JUL-2023,0.09%
381,Washington D C Met Area Tran Auth Gross Rev 5.0% 01-JUL-2023,0.09%
382,Utah St Bldg Ownership Auth Lease Rev 5.0% 15-MAY-2023,0.09%
383,Nevada St Hwy Impt Rev 5.0% 01-DEC-2023,0.09%
384,Connecticut St 5.0% 15-APR-2023,0.09%
385,Austin Tex Wtr & Wastewater Sys Rev 5.0% 15-NOV-2023,0.09%
386,Minnesota Pub Facs Auth St Revolving Fd Rev 5.0% 01-MAR-2023,0.09%
387,Northwest Tex Indpt Sch Dist 5.0% 15-FEB-2023,0.09%
388,Ohio St 4.0% 01-SEP-2023,0.09%
389,Rhode Island Health & Edl Bldg Corp Higher Ed Fac Rev 5.0% 01-SEP-2023,0.09%
390,Los Angeles Calif Cmnty College Dist 5.0% 01-AUG-2023,0.09%
391,Norfolk Va 5.0% 01-AUG-2023,0.09%
392,New York N Y City Transitional Fin Auth Rev 5.0% 01-FEB-2023,0.09%
393,Illinois Fin Auth Rev 5.0% 01-JAN-2023,0.09%
394,Phoenix Ariz Civic Impt Corp Wtr Sys Rev 5.0% 01-JUL-2023,0.09%
395,University Calif Revs 4.0% 15-MAY-2023,0.09%
396,District Columbia 5.0% 01-JUN-2023,0.09%
397,Hamilton Cnty Tenn 5.0% 01-MAY-2023,0.09%
398,New York St 4.0% 01-MAR-2023,0.09%
399,Texas St 5.0% 01-OCT-2023,0.09%
400,Pennsylvania St 5.0% 15-MAR-2023,0.09%
401,Florida St Dept Mgmt Svcs Ctfs Partn 5.0% 01-AUG-2023,0.09%
402,Oregon St 5.0% 01-MAY-2023,0.09%
403,Wisconsin St 5.0% 01-MAY-2023,0.09%
404,Washoe Cnty Nev Sch Dist 5.0% 01-JUN-2023,0.09%
405,Virginia St Res Auth Infrastructure Rev 5.0% 01-NOV-2023,0.08%
406,Clark Cnty Nev 5.0% 01-NOV-2023,0.08%
407,San Angelo Tex Indpt Sch Dist 5.0% 15-FEB-2023,0.08%
408,Virginia St Pub Sch Auth 5.0% 01-AUG-2023,0.08%
409,Ohio State 5.0% 01-AUG-2023,0.08%
410,Prince Georges Cnty Md 5.0% 01-JUL-2023,0.08%
411,Multnomah Cnty Ore Sch Dist No 1J Portland 5.0% 15-JUN-2023,0.08%
412,Florida St 5.0% 01-JUL-2023,0.08%
413,New Jersey St Tpk Auth Tpk Rev 5.0% 01-JAN-2023,0.08%
414,Santa Fe Cnty N Mex Gross Rcpts Tax Rev 5.0% 01-JUN-2023,0.08%
415,Metropolitan Transn Auth N Y Rev 5.0% 15-NOV-2023,0.08%
416,Reedy Creek Impt Dist Fla 5.0% 01-JUN-2023,0.08%
417,Pennsylvania St 5.0% 01-APR-2023,0.08%
418,Houston Tex Indpt Sch Dist 5.0% 15-FEB-2023,0.08%
419,North Tex Twy Auth Rev 5.0% 01-JAN-2023,0.08%
420,Washington Subn San Dist Md 4.0% 01-JUN-2023,0.08%
421,Energy Northwest Wash Elec Rev 5.0% 01-JUL-2023,0.08%
422,Port Seattle Wash 5.0% 01-JUN-2023,0.08%
423,North Tex Mun Wtr Dist Upper E Fork Wstwtr Intrcpt Contract Rev 5.0% 01-JUN-2023,0.08%
424,Pierce Cnty Wash Sch Dist No 320 Sumner 5.0% 01-DEC-2023,0.08%
425,Wake Cnty N C Ltd Oblig 5.0% 01-DEC-2023,0.08%
426,New York St Dorm Auth Sales Tax Rev St Supporteddebt 5.0% 15-MAR-2023,0.08%
427,California St 5.0% 01-NOV-2023,0.08%
428,California St Pub Wks Brd Lease Rev 5.0% 01-NOV-2023,0.08%
429,Minnesota St 5.0% 01-OCT-2023,0.08%
430,Texas St 5.0% 01-OCT-2023,0.08%
431,Killeen Tex Indpt Sch Dist 5.0% 15-FEB-2023,0.08%
432,Seattle Wash Mun Lt & Pwr Rev 5.0% 01-OCT-2023,0.08%
433,California St 5.0% 01-SEP-2023,0.08%
434,California St Pub Wks Brd Lease Rev 5.0% 01-SEP-2023,0.08%
435,Texas St 5.0% 01-AUG-2023,0.08%
436,University Utah Univ Revs 5.0% 01-AUG-2023,0.08%
437,Massachusetts St 5.0% 01-JUL-2023,0.08%
438,Los Angeles Calif Uni Sch Dist 5.0% 01-JUL-2023,0.08%
439,Wisconsin St Environmental Impt Fd Rev 5.0% 01-JUN-2023,0.08%
440,Palomar Calif Cmnty College Dist 0.0% 01-AUG-2023,0.08%
441,North Carolina St Ltd Oblig 5.0% 01-MAY-2023,0.08%
442,Hawaii St 5.0% 01-MAY-2023,0.08%
443,Port Portland Ore Arpt Rev 5.0% 01-JUL-2023,0.08%
444,California St 5.0% 01-DEC-2023,0.08%
445,New York St Urban Dev Corp Rev 5.0% 15-MAR-2023,0.08%
446,New York St Urban Dev Corp Rev 5.0% 15-MAR-2023,0.08%
447,Montgomery Cnty Md 5.0% 01-NOV-2023,0.08%
448,Oklahoma Transn Auth Ok F/K/A Oklahoma St Tpk Auth 4.0% 01-JAN-2023,0.08%
449,Abilene Tex Indpt Sch Dist 5.0% 15-FEB-2023,0.08%
450,Prosper Tex Indpt Sch Dist 5.0% 15-FEB-2023,0.08%
451,San Antonio Tex Elec & Gas Rev 5.0% 01-FEB-2023,0.08%
452,Texas A & M Univ Perm Univ Fd 5.25% 01-JUL-2023,0.08%
453,Lewisville Tex Indpt Sch Dist 5.0% 15-AUG-2023,0.08%
454,Minnesota St 5.0% 01-AUG-2023,0.08%
455,Jacksonville Fla Transn Auth Loc Opt Gas Tax Rev 5.0% 01-AUG-2023,0.08%
456,New York N Y City Mun Wtr Fin Auth Wtr & Swr Sysrev 4.0% 15-JUN-2023,0.08%
457,Los Angeles Calif Uni Sch Dist 5.0% 01-JUL-2023,0.08%
458,Texas A & M Univ Perm Univ Fd 5.0% 01-JUL-2023,0.08%
459,Folsom Cordova Calif Uni Sch Dist Sch Facs Imptdist No 4 0.0% 01-OCT-2023,0.08%
460,King Cnty Wash 5.0% 01-DEC-2023,0.08%
461,King Cnty Wash 5.0% 01-DEC-2023,0.08%
462,Broward Cnty Fla Sch Brd Ctfs Partn 5.0% 01-JUL-2023,0.08%
463,California St Pub Wks Brd Lease Rev 5.0% 01-MAR-2023,0.08%
464,New Castle Cnty Del 5.0% 01-OCT-2023,0.08%
465,New York N Y City Transitional Fin Auth Rev 5.0% 01-NOV-2023,0.08%
466,Columbus Ohio 5.0% 15-AUG-2023,0.08%
467,Miami Univ Ohio Gen Rcpts 5.0% 01-SEP-2023,0.08%
468,Virginia St Pub Bldg Auth Pub Facs Rev 5.0% 01-AUG-2023,0.07%
469,Anchorage Alaska 5.0% 01-SEP-2023,0.07%
470,Harris Cnty Tex 5.0% 15-AUG-2023,0.07%
471,Delaware St 5.0% 01-JUL-2023,0.07%
472,New Jersey St Tpk Auth Tpk Rev 5.0% 01-JAN-2023,0.07%
473,Florida St Tpk Auth Tpk Rev 5.0% 01-JUL-2023,0.07%
474,Austin Tex Cmnty College Dist 5.0% 01-AUG-2023,0.07%
